,reference,transcription
312,कैलिफोर्निया के गवर्नर अर्नोल्ड श्वार्ज़नेगर ने कानून में एक बिल पर हस्ताक्षर किए जो नाबालिगों को हिंसक वीडियो गेम उन्हें बेचने या किराए पर देने से प्रतिबंध लगाता है, कालिपर्निया के गवर्नर अर्नर्ड स्वाजनेगर ने कानून में एक बील पर हत्सताक्यर किये जो नाबाली कू के हिन्सक विडियो गेम उन्ने बेचने या किराय पर देने से प्रतिबंधल लगाया है। कालिपर्निया के गवर्नर अर्नर्ड स्वाजनेगर ने कानून में एक बील पर हत्सताक्यर किये जो नाबाली के हिन्सक विडियो गवर्नर अर्नर्ड स्वाजनेगर लगाया है।
313,गोभी का जूस अम्लीय या आधारभूत क्षारीय रसायन के आधार पर रंग बदलता है, गोबी का जुस अमलिय या आधार बूत रसायन के अधार पर रंग बदलता है।
314,हमारे ग्रह की नदियों से महासागरों में जाने वाले पानी का 20% हिस्सा अमेज़न से आता है, हमारे गरह की नदियों से महासागरों में जाने वाले पानी का 20% हिस्सा अमेजन से आता है।
315,हम पक्के तौर पर नहीं जानते हैं लेकिन इसकी कांटेदार जीभ हो सकती है इसके आहार में कछुए बड़ी मछली दूसरे मोसासॉर शामिल थे और ये एक नरभक्षी भी हो सकता है," हम पक्के तौर्पर नहीं जानते हैं लेकिन इसकी काटेडार जीब हो सकती हैं इसके आर में कचूए बढ़ी मचले, दुसरे मौसासूर सामिन थें और यह एक नर्भक्षी भी हो सकता है"
316,तथा क्रांति के बाद व्यवसाय सभी पुरुष आवेदकों के लिए खुले थे जिसमें सबसे महत्त्वाकांक्षी और सफल होने वाले सफल हो सकते थे, तुप्पाक्ड्रान्तिक्व बादी अभसाइसा दिप पुडुसाव रदो पोर्ण्विय पुलो तुछीस्नि आसाप शब्सो बहात पाक्मुश्यास। पर अपना हाँ राज से वेने उजाप देखुंग।
317,उदाहरण के लिए नॉर्थ कैरोलिना के बेनेट स्कूल के हज़ारों स्टूडेंट्स हर साल राज्य की राजधानी की अपनी यात्रा के बारे में एक वेबसाइट डिज़ाइन करते हैं वेबसाइट हर साल फिर से तैयार की जाती है लेकिन कुछ पुराने वर्ज़न्स को स्क्रेपबुक के रूप में इस्तेमाल करने के लिए ऑनलाइन रखा जाता है, अधारन के लिए नौर्थ कैरोलीना के बेनेट स्कूल के हजारो स्टॉडेंट्स हर साल राज की राज़ानी की अपनी आत्रा के बारे में एक वेब्साइट डिजान करते हैं वेब्साइट हर साल फिर से त्यार की जाती हैं लेकिन कुछ पूराने वर्जन्स को इस्क्रैब बॉक के रूप में इस्तमाल करने के लिए आउन्लाइन रखा जाता हैं
318,आम शब्दों में जब प्रबंधक अपने पूर्व सहयोगियों का नेतृत्व करना शुरू करते हैं तो दो तरह के बर्ताव सामने आते हैं. स्पेक्ट्रम का एक सिरा  उन लड़कों में से एक” या लड़कियों में से एक बने रहने की कोशिश कर रहा है," अहम शब्तों में जब प्रबंदक अपने पूर्से योगियों का नेत्रत्व करना शुरू करते हैं, तो दो तरह के बर्ताव सामने आते हैं. स्पेक्ट्रुम का एक सिरा उन लड़को में से एक या लड़कियों में से एक बने रहने की कोशिश कर रहा है।"
319,शत्रुता फैलाने के तुरंत बाद ब्रिटेन ने जर्मनी की समुद्री घेराबंदी शुरू कर दी थी, शतुर्ता फैलाने के तुरन बाद ब्रिटन ने जर्मनी की समुद्री गेरा बंदी सुरू कर दी थी
320,यह ऑरोरा बोरेलिस को देखने का एक अच्छा अवसर प्रदान करता है क्योंकि आकाश में उस समय अंधकार सा ही रहेगा, ये आरूरा बोरेलिस को देखने का एक अच्छा अपसर बर्दान करता है क्यूकि आकाश में उस सम्में अन्दकार साही रहेगा
321,हालांकि यह सच नहीं है हालांकि दस्तावेज़ के पीछे कुछ लिखा हुआ है लेकिन यह कोई ख़ज़ाने का नक्शा नहीं है," हाला की यह सच नहीं है, हाला की दस्तावेज के पीछे कुछ लिखा हुआ है, लेकिन यह कोई खजाने का नक्षा नहीं है"
322,बाहरी द्वीपों पर क्रेडिट कार्ड शायद स्वीकार नहीं किए जाएंगे हालांकि ब्रिटिश और संयुक्त राज्य की मुद्रा स्वीकार्य होगी यह निर्धारित करने के लिए कि स्वीकार्य भुगतान विधि क्या है मालिकों से पहले ही पूछ लें, बहारी द्वीपो पर क्रेडिट कार्ट शाहिद स्विकार नहीं किये जाएंगे हालाकी प्रतिश और सैयूक्त राजि की मुद्रा स्विकार्य होंगी यह निर्दारत करने के लिए कि स्विकार्य भुक्तान विधी क्या है मालिकों से पहले ही पूछले
323,बार्सिलोना की आधिकारिक भाषाएं कातलान और स्पेनिश हैं लगभग आधे लोग कातलान बोलना पसंद करते हैं एक बहुत बड़ी जनसंख्या में लोग इसे समझते हैं और लगभग हर कोई स्पेनिश जानता है, बार्शिलोना के अधिकारिक भाशाएं कात्लान और स्पेनिज से लगभाग आदे लोक कात्लान बोलना पासं करते हैं एक बहुत बड़ी जन्सिंख्यां में लोक इसे समझते हैं और लगभाग हर कोई स्पेनिज जानता हैं.
324,फ़ोटोग्राफ़रों ने बाद में एक वृद्ध महिला की जगह ले ली क्योंकि उसे शौचालय जाना ज़रूरी था मेंडोज़ा को गोली मार दी गई थी," फोटोग्राफरों ने बाद में एक प्रिद्ध महिला की जगह ले लिए, क्योंकि उसे शौ चाले जाना जारूरी था, मेंडोजा को गोली मार दी गयी थी."
325,विशेष रूप से सवाना पर बेहतरीन अफ़्रीकी वन्य जीवन को संपूर्ण रूप से देखने के लिए आमतौर पर सफ़ारी शब्द का उपयोग किया जाता है, बिसेश रूप से सवाना पर बहतरी अप्रिकी बन्य जिबन को संपुन रूप से देखने के लिए आम तोर पर सपारी सब्त का रूप यूब क्या जाता है।
326,मध्य क्रम के बल्लेबाज सचिन तेंदुलकर और राहुल द्रविड़ ने अच्छा प्रदर्शन किया और शतकीय साझेदारी बनाई, मद्यक्रम के बल्लिवाज सचिन्ते अंदुलकर और राहुल द्रविड ने अच्छा प्रदशन किया और सत्की साजडारी बनाई।
327,ऐसा माना जाता है कि पेरिस के निवासी अहंकारी असभ्य और अभिमानी होते हैं, ऐसा माना जाता है कि पैरिस की निवासी एंकारी असभ्य और अभीमानी होते हैं।
328,बच्चों के लिए बनी जगह में पिरामिड साउंड एंड लाइट शो सबसे दिलचस्प चीज़ों में से एक है, बच्चों के लिए बनी जगह में पिरामिड साउंड एंड लाइट शोज सब से दिल्चास पचीजो में से एक है।
329,ऐसी संस्कृति को सभ्यता कहते हैं जो लोगों के एक बड़े समूह में साझा की जाती है यहां लोग आपसी सहयोग करते हुए समाज में रहते हैं और मिलकर काम करते हैं, यहाँ लोग आपसी सहियोग करते हुए समाज में रहते हैं और मिलकर काम करते हैं।
330,इसके मुंह के तालु में एक अतिरिक्त सेट के साथ ही 70 से ज़्यादा रेजर की तरह नुकीले दांतों से भरे इसके लंबे जबड़े थे जिसका अर्थ है कि उसके रास्ते से गुज़रने वाली किसी भी चीज़ के लिए कोई बचाव नहीं था, इसके मू के तालू में एक अतिर सेट के साथ ही 70 से जादा रेजर की तरह नुकील डातो से भरे इसके लंबे जब्रे थे जिसका अर्त है कि उसके रास्ते से गुज़रने वाली किसी भी चीस के लिए कोई बचाव नहीं था
331,वर्चुअल स्कैफ़ोल्ड सॉफ़्टवेयर का ही अंदरूनी हिस्सा होते हैं और वे ऐसी प्रक्रियाओं पर सवाल उठाते हैं उनका संकेत देते हैं और उनके बारे में जानकारी देते हैं जो छात्र के लिए अकेले संभालने में चुनौती भरी होती हैं, VIRTUAL SCAPHOLD SOFTWARE का ही अंद्रूनी हिस्था होते हैं और वे ऐसी प्रक्रियां पर सवाल उठाते हैं उनका संकेट देते हैं और उनके बारे में जानकारी देते हैं जो चातर के लिए अकेले संभाले में चुनाती भरी होती हैं
332,अस्पताल में काम करते हुए लिगिन्स ने अपने खाली समय के दौरान समय से पहले प्रसव की जांच शुरू कर दी, असपतर में काम कटते हुए लिगिन्स ने अपने खाली समर के दोरान समय से पहले प्रसब की जान्ट सूरू कर दी।
333,मोहम्मद इस सांसारिक जीवन से परे मामलों में गहरी रुचि रखते थे। वे अक्सर चिंतन के लिए एक गुफा का उपयोग करते थे जिसे  नूर” प्रकाश के पर्वत पर  हीरा” के रूप में जाना जाता है।, मुहम्मत् इस सांसारिक जीवन से परे मामलो में गहरी नुची रखते थे वे अकसर चिन्तन के लिए एक गूफां का प्रेवोग करते थे जिसे नूर के परवत पर हीरा के रूप में जाना जाता है
334,उत्तर में यह क्षेत्र साहेल और दक्षिण और पश्चिम में अटलांटिक महासागर से घिरा है, उतर में यहचत्र साहिल और दक्षिन और पष्छिम में अत्लांटिक महसागर से गिरा है।
335,अंडरवॉटर टोपोलॉजी के कारण कुछ गहरे सेक्शन्स में रिटर्न फ़्लो सांद्र होता है और यहां से गहरे पानी में तेज़ प्रवाह हो सकता है, Underwater topology के कारण कुझ कहरे sections में return flow सांद्र होता है और यहां से कहरे पानी में तेज प्रवा हो सकता है
336,चीज़ों पर कुछ बनाकर या खरोंच कर इस जगह को नुक़सान न पहुंचाएं, चीजों पर कुछ बना कर या खरुट कर इस जोगा को नॉक्सान नो पोचाये।
337,यह समुद्र के नीचे पतला और ऊंचे क्षेत्रों के नीचे मोटा होता है, यह समुद्र के निच्चे पत्ला और उच्चे चेत्रों के निच्चे मोटा होता है।
338,मक्का के उत्तर में स्थित पहाड़ों में से एक के शीर्ष पर स्थित गुफा दुनिया के बाकी हिस्सों से पूरी तरह कटी हुई है, मक्का के उद्दर में स्थिद पहाडो मेसे एक के शीश पस्तिद गूफा दुनिया के बाकी इसो से पूरी तरा कटी हुई है।
339,तूफ़ान कैटरीना के मद्देनज़र राहत और पुनर्निर्माण पर चल रहे लंबे विवाद से बहस छिड़ गई थी जिसमें कुछ राजकोषीय रूढ़िवादियों ने बुश की न्यू ऑरलियन्स डील का मज़ाक बनाया है, तूफान कैटरीना के मदे नजर राहत और पूर्न निर्मान पर चल रहे लंबे विवाद से बहस शिर गई थी जिसमें कुछ राजकोषिय रूडी वादियों ने बॉश की नियू अर्लियन स्टील का मजाग बनाया है
340,अगर हमारे अपने पूर्वजों ने अपनी प्रोटीन की समस्या को कुछ हद तक उसी तरह सुलझाया तो हमें आश्चर्यचकित नहीं होना चाहिए जैसे कि आज के समय में चिंपाजी करते हैं," अगर हमारे अपने पूर्वजों ने अपनी प्रोटीन की समस्या को कुछ हाथ तक उसी तरा सुल जाया, तो हमें आश्चरिचकत नहीं हुना चाहिए, जैसे के आज के समय में चिंपान जी करते हैं।"
341,सत्ताधारी दल साउथ वेस्ट अफ्रीका पीपल आर्गेनाइजेशन स्वापो ने संसदीय चुनाव में बहुमत पाया, सत्था धारिदल साउथ विस्ट अफ्रीका पीपल अर्गनाइजेशन सवापू ने सन्सदिए चनाओ में बहुमत पाया.
342,अंत में कई ऐसी छोटी बिल्लियाँ लूज़ पेट कैट्स सहित हैं जो कीट रोडंट्स छिपकलियों और पक्षियों जैसे कई छोटे जीवों को खाती हैं," अन्त में कई ऐसी चोटी बिल्लियां लूस, पेट, कैट सहित हैं जो कीट, ड्रोड़ेंज चिप कलियों और पक्षियों जैसे कई चोटे जीवों को खाती हैं"
343,राज्यपाल के कार्यालय ने बताया कि घायलों में से उन्नीस पुलिस अधिकारी थे, राज्यपाल के कार्याले ने बताया कि गाईलो मेसे उन्निस पॉलिस अधिकारी थे।
344,हम पक्के तौर पर नहीं जानते हैं लेकिन इसकी कांटेदार जीभ हो सकती है इसके आहार में कछुए बड़ी मछली दूसरे मोसासॉर शामिल थे और ये एक नरभक्षी भी हो सकता है," हम पक्के तौर पर नहीं जानते हैं, लेकिन इसकी कांटेडार जीब हो सकती हैं, इसके आहार में कछूए, बड़ी मचली, दुसरे मौक्ष आहार शामिल थे, और ये एक नर्भक्ची भी हो शकता हैं."
345,बच्चों के लिए बनी जगह में पिरामिड साउंड एंड लाइट शो सबसे दिलचस्प चीज़ों में से एक है, बच्छों के लिए बनी जगा में पिरामिट साउंड औंड लाइट शो सब से दिल्चस्ट जीजो में से एक है।
346,सड़कों पर ज़्यादा दुर्घटना की वजह बहुत ज़्यादा कार ओनरशिप है जिससे शरीर में हुई टूट-फूट को सुधारने के लिए हेल्थकेयर में नई तकनीकों के आविष्कार को बढ़ावा मिला है," सर्कों पर ज़ादा दृर्भाटना की वजह बहुत ज़ादा कार ओनर्शिप है, जिससे शरीर में हुई तूट फूट को सुधारने के लिए, हेल्थ केर में नहीं तक्नीकियों का विष्कार को बढ़ावा मिला है।"
347,कुछ अणुओं में अस्थिर केंद्रक होता है जिसका मतलब यह है कि उनमें थोड़े या बिना किसी झटके से टूटने की प्रवृत्ति होती है, कुछ अनों में अस्तिर केंद रख होता है जिसका मतलबिया है कि उनमें थोड़े या बिना किसी जट्के से तूटने की प्रवरत्ति होती है
348,पौधे ऑक्सीजन बनाते हैं जिसका उपयोग मनुष्य साँस लेने में करते हैं और वे कार्बन-डाइऑक्साइड लेते हैं जो मनुष्य साँस से छोड़ते हैं यानी साँस छोड़ते हैं," पौदे अक्सिन बनाते हैं, जिसका उप्योग मनुश्यों सास लेने में करते हैं, और वे कार्बन डायोक्साइट लेते हैं, जो मनुश्यों सास से छोडते हैं, यानि सास छोडते हैं."
349,जापान की परमाणु एजेंसी के अनुसार प्लांट में रेडियोधर्मी सीज़ियम और आयोडीन की पहचान की गई है," जापान की परमानो एजंसी के अनुसार पलान्ट में रेडियो धर्मी, सीर्जिम और आयोडिन की पहचान की गई है।"
350,यह समुद्र के नीचे पतला और ऊंचे क्षेत्रों के नीचे मोटा होता है, यह समुद्र के निज़े पतला और उचे शेत्रों के निज़े मोटा होता है।
