,reference,transcription
0,कुछ अणुओं में अस्थिर केंद्रक होता है जिसका मतलब यह है कि उनमें थोड़े या बिना किसी झटके से टूटने की प्रवृत्ति होती है, कुछ अड़ोंगों में आर्स्त केंद्रक होता है जिसका मतलब यहाँ कि उन्में थोड़े या बिना किसी जट्के से तूटने की प्रवत्ती होती है
1,ग्रीनलैंड को बहुत कम जगह बसाया गया था नॉर्स सगास में वे कहते हैं कि एरिक रेड हत्या के लिए आइसलैंड से निर्वासित किया गया था और आगे पश्चिम की यात्रा करते समय ग्रीनलैंड मिला जिसे ग्रीनलैंड नाम दिया गया," ग्रीनलेंड को बहुत कुम जग़ बसाया घया था, नौर्स सगास में वे कहते हैं, कि एरिक रिड हत्या के लिए आइसलेंड से निर्वासित किया घया था, और आगे पश्चम की यात्र करते समय ग्रीनलेंड मिला जिसे ग्रीनलेंड नाम दिया घया."
2,ऐसी कोई वैश्विक परिभाषा नहीं है जिसके लिए निर्मित सामान एंटीक होते हैं कुछ कर एजेंसियां 100 साल से पुराने सामान को एंटीक के तौर पर परिभाषित करती हैं," आइसी कोई वस्पिक परिवाशा नहीं हैं, जिसके लिए निर्वित समान अंटिक होते हैं, कुछकर एजन्षिया शव साल से पूराने समान को अंटिक के तोर पर परिवाशित करती हैं।"
3,टेलीविजन रिपोर्टों में प्लांट से निकलने वाला सफेद धुआं दिखाया गया है, तेनीविजन रेपोटों में प्लांट से निकलने वाला सबे दुआ दिखाया गया है।
4,इंटरनेट पर यह खोज शत्रुतापूर्ण पर्यावरण पाठ्यक्रम के लिए अक्सर आपको एक स्थानीय कंपनी का पता प्रदान करेगी, इंटर्नेट पर ये खोज सत्रुता पुर्न पर्यावरन पाठिकरम के लिए अक्सर आपको एक इस्थान्नी कंपनी का पता प्रदान करेगी।
5,अपनी सरकार के अलावा आप अन्य देशों की सरकारों की सलाह ले सकते हैं हालांकि उनकी सलाह उनके नागरिकों को ध्यान में रखकर दी जाती हैं," अपनी सर्कार के अलावा आन्य देशों की सर्कारों की सला ले सकते हैं, हाला की उनकी सला उनके नागरिकों को ध्यान में रखकर दी जाती हैं."
6,प्राचीनकाल से ही लोग सोने चांदी और तांबे जैसे रासायनिक तत्वों के बारे में ही जानकारी रखते हैं क्योंकि इन्हें प्रकृति में मूल स्वरूप में ढूंढा जा सकता है और इन्हें प्राथमिक उपकरणों के ज़रिए ढूंढना अपेक्षाकृत आसान है, प्राचीन काल से ही लोग सोने चादी और तामबे जसरा सायनिक तत्पो के बारे में ही जानकारी रखते हैं क्यूकि इन्हें प्रक्रिति में मुल्सवरी में दूना जा सकता है और इन्ने प्रात्मिक उपकर्णो के जर्विये दूनना अपिक्षक्रित आसान है
7,इसे केमिकल का ph कहा जाता है आप लाल गोभी के जूस का इस्तेमाल करके एक संकेतक बना सकते हैं," इसे कैमिकल का प्येज कहा जाता है, आप लाल गोबी के जॉस को इस्तमाल करके एक संके तक बना सकते हैं।"
8,सबसे नज़दीकी सिरे पर क्रस्ट की मोटाई करीब 70 किलोमीटर है और सबसे दूर के सिरे पर यह 100 किलोमीटर है, सब से नज़ी के सिरे पर कृष्ट की मोटाई करिव 70 किलोमेटर है और सब से दूर के सिरे पर यह 100 किलोमेटर है
9,यह संबंधित है लेकिन आम तौर पर इसमें अल्पाइन शैली की स्की टूरिंग या माउंटेनीयरिंग शामिल नहीं होती है जिसे खड़े इलाकों में किया जाता है और जिसके लिए बहुत कड़ी स्की और बूट की ज़रूरत होती है, यह समंदित है लेकिन आमतोर पर इसमें आल्पाइन शैले की स्की तूरिंग यह माॉंटेन येरं शामिल नहीं होती है जिसे खड़े इलाकों में किया जाता है और जिसके लिए बहुत कड़ी स्की और बूट की जर्मूत होती है
10,पुरुषों के स्टैंडिंग सुपर-जी में ऑस्ट्रेलिया के मिशेल गौरले ग्यारहवें स्थान पर रहे चेक प्रतियोगी ओल्डरिच जेलिनेक पुरुषों के सिटिंग सुपर-जी में सोलहवें स्थान पर रहे, पुर्शों के standing super G में Australia के Michelle Gourley 11 में स्थान पर रहे चक प्रतियोगी Aldrich Jellynac पुर्शों के sitting super G में 16 में स्थान पर रहे
11,केवल दो हफ़्तों में अमेरिकियों और फ़्री फ़्रेंच बलों ने दक्षिणी फ़्रांस को मुक्त कर दिया था और जर्मनी की ओर बढ़ रहे थे, केवल दो हफतो में अमेरिकियो और फुरी फ्रेज बलो ने दक्षणी फ्रान्स को मुक्त कर दिया था और चार्मिनी की वर बढ रहे थे।
12,ms बीमारी केंद्रीय तंत्रिका तंत्र पर असर करती है जिसमें दिमाग स्पाइनल कॉर्ड और ऑप्टिक नर्व शामिल हैं," M.S. बीमारी केंद्रिय तंट्र का तंट्र पर असर करती है, जिसमें दिमांग इस्पाइनल कौड और अप्टिक नर्व शामिल हैं."
13,हर कोई समाज से जुड़ा होता है और ट्रांसपोर्ट सिस्टम का उपयोग करता है लगभग सभी लोग ट्रांसपोर्ट सिस्टम के बारे में शिकायत करते हैं, हरकोई समाज से जुड़ा होता है और ट्रानस्पृट सिस्टम का प्योक करता है लगभक सभी लोग ट्रानस्पृट सिस्टम के बारे में शिकायत करते हैं
14,एक पूरी तरह से विकसित एथलीट की तरह बाघ चढ़ाई कर सकता है हालाँकि अच्छी तरह से नहीं तैर सकता है बड़ी दूरी तक छलांग लगा सकता है और एक शक्तिशाली मनुष्य के पाँच गुना बल के साथ खींच सकता है, एक पूरी तरह से बिकसित एथलीट की तरहा बाग चढ़ाई कर सकता है हाला के अच्छी तरह से नहीं तेर सकता है बड़ी दूरी तक चलंग लगा सकता है और एक सक्तिसाले मनश के पांच गुना बल के साथ खिंज सकता है
15,विशेष रूप से सवाना पर बेहतरीन अफ़्रीकी वन्य जीवन को संपूर्ण रूप से देखने के लिए आमतौर पर सफ़ारी शब्द का उपयोग किया जाता है, विषेश रूप से सवान पर भिठ्तरीन अफ्रीगी वन्न जीवन को सम्पुन रूप से देखने के लिए आमतोर पर सफारी शब्ध का उप्योग किया जाता है।
16,गंभीर मौसम किसी भी खतरनाक मौसमी घटना के लिए वर्गीय शब्द है जिसमें नुकसान गंभीर सामाजिक व्यवधान या मानव जीवन की हानि की संभावना है," गमबीर मौसम किसी भी खतनाक मौसमी गतना के लिए वर्गी ये सब्द है, जिसमें नुक्षान गमबीर सामाजिक वेवदान या मानव जीवन की हानी की सम्वापना है।"
17,हालांकि यह अकेला नहीं है प्रयोग करना और प्रयोग एक ऐसा परीक्षण होता है जिसका इस्तेमाल करके एक या इससे ज़्यादा संभावित परिकल्पनाओं को ख़त्म करने सवाल करने और अवलोकन करने से भी वैज्ञानिक शोध को मार्गदर्शन मिलता है," हाला कि यह अकेला नहीं है, प्रेवोग करना और प्रेवोग एक ऐसा परिशण होता है, जिसका इस्तिमाल करने एक या इस्से जादा समभावित परिकाल पराओं को खात्व करने के सबाल करने और अबलोकन करने से ही भैज्यानिक सूध कू मर्गदशन बिलता है।"
18,कैल्शियम और पोटैशियम जैसे तत्वों को धातु माना जाता है बेशक चांदी और सोने जैसी धातुएं भी हैं," केल्सियम और पोतेसियम जैसे तत्वों को दातू माना जाता है बेश, चांदी और सोने जैसी दातू ये भी है"
19,हॉट चॉकलेट बेल्जियम के मानकों पर बनी है फलों का जूस महंगा है लेकिन बहुत अच्छा है, लेकिन बहुत अच्छा है।
20,जिस समय घटनाएँ हुई उसके युग को सामान्य रूप से यूरोप के इतिहास में 11वीं 12वीं और 13वीं सदी ad 1000-1300 में यूरोपियन इतिहास के उच्च मध्य युग की अवधि के रूप में बताया जाता है," जिस समय घत्नाए हुए उसके यूब को सामान्ने रूप से यूरोब के इतिहास में ग्यारवी, बारवी, और तेरवी सदि में यूरोपियन इतिहास के उच्मद्यव यूब की अवधि के रूप में बताया जाता हैं।"
21,कुछ लोगों ये सोचते थे की कि वह सही था लेकिन बहुत से लोग इसके विपरीत मानते थे; की सौर मंडल सूर्य और यहां तक कि अन्य सितारों सहित पृथ्वी के चारों और चक्कर लगता था ।, कुछ लोग यह सोषते थे कि यह सही था लेकिन बहुत से लोग इसके विपरित मानते थे कि सोर्मंडल सुर्य और यहाँ तक कि अन्य सितारे सहित प्रिछ्वी के चारो वर्चकर लगाता था
22,यदि आप केवल शिपबोर्ड भ्रमण का उपयोग करके किनारे तक जाते हैं तो आपको एक अलग वीज़ा की आवश्यकता नहीं होगी 2009 तक, यदि आप केवल शिप बौड ब्रमन का उप्यो करके किनारे तक जाते हैं तो आपको एक अलग वीजा की अवशकता नहीं होगे 2009 तक
23,यहूदी और गैर-यहूदी की तरह अभी भी ऐसे कई पुरुष और महिलाएं जीवित हैं जो उस समय बचने में सफल रहे और कई जिनके प्रियजनों को मार दिया गया या उनके मरने तक उनसे काम करवाया गया," यहूदी और गैव यहूदी की तरा, अभी भी ऐसे कई पूरुश और महिलाय जीवित हैं, जो उस सम्हें बचने में सफल रहे और कई जिनके प्रियजनों को मार दिया गया या उनके मरने तक उनसे काम कर वाया गया।"
24,इटैलियन भी रोज़ाना इस्तेमाल होने वाली भाषा है जिसे राज्य में काम करने वाले अधिकांश लोग उपयोग में लाते हैं जबकि लेटिन का धार्मिक रस्मों में इस्तेमाल किया जाता है," इटालियन भी रोजाना इस्तिमाल होने वाली भाशा है, जिसे राज में काम करने वाले अधिकांस लोग उप्योग में लाते हैं, जबकि लेटिन का धारमिक रस्मो में इस्तिमाल किया जाता है।"
25,लोग यह अनुमान नहीं लगा सकते हैं कि घर लौटने वाले यात्रियों के लिए धैर्य और समझ भी आवश्यक है, लोग या नुमान नहीं लगा सकते हैं कि घर लौटने वाले यात्रियों के लिए धैर्य और समझ भी आवश्यक है।
26,उन्होंने अफवाहों को राजनीतिक बकवास और मूर्खतापूर्ण कहा, उम्हु ने नख्वा उको राज नितिक बप्वा सुर्मुक ताप्मु काहा
27,इंटरनेट लोगों और अंतर-परस्पर संचार दोनों के तत्वों को मिलाता है, इन्टेनेट लोगों और अंतर पर अस्पर संजाद दोनों के तत्नों को मिलाता है।
28,तकनीकी निर्धारण की ज़्यादातर व्याख्याएं दो सामान्य विचारों के बारे में बताती हैं तकनीकी विकास पर सांस्कृतिक या राजनीतिक असर का कोई भी प्रभाव नहीं पड़ता है और परिणामस्वरूप सामाजिक रूप से अनुकूलित होने के बजाय वह तकनीक निहित समाजों को प्रभावित करती है, तकनिकी निर्धारन की ज्यादतर व्याक्यान दो समानने विचारों के बारेमे बताती हैं। तकनिकी विकास पर सांसकिर्तिक या राजनितिक असर का कोई भी पर्भाव नहीं परता है और परिनाम सवरूप समाजिक रूप से अनुकुलित होने के भजाए वो तकनीक निहित समाजों को प्रभावित करती हैं.
29,केवल दो हफ़्तों में अमेरिकियों और फ़्री फ़्रेंच बलों ने दक्षिणी फ़्रांस को मुक्त कर दिया था और जर्मनी की ओर बढ़ रहे थे, केवल दो हप्तों में अम्रीकियों और फ्री फ्रेज बलू ने नक्छिन फार्श को मुक्त कर दिया था और जर्मानी के और बढ़ रहे थे
30,यूनिवर्सिटी ऑफ़ डंडी के प्रोफ़ेसर पामेला फ़र्ग्यूसन लिखते हैं अगर संदिग्धों के फ़ोटो आदि प्रकाशित होते हैं तो पत्रकारों को यह ख़तरनाक मार्ग पर चलना लगता है," University of Dundee के Professor Pamela Fungerson लिखते हैं, अगर संदिदो की फोटो आदी प्रकाशित होती है तो पत्रकारो को यह खतरना मार्क पर चलना लगता है।"
31,उनका सिंगापुर के उप-प्रधान मंत्री वोंग कान सेंग ने स्वागत किया और उन्होंने सिंगापुर के प्रधानमंत्री ली सिएन लूंग के साथ व्यापार और आतंकवाद के मामले पर बातचीत की, उनका सिंगपूर्ते उप प्रदान मंत्री वोंग कान्सेंग ने स्वागत गिया। और उन्हुने सिंगपूर्ते प्रदान मंत्री ली सिएन लू के स्थात व्योप्यापार और अतंग्वात के मामले पर्भाचित की।
32,विखंडन बम इस सिद्धांत पर काम करता है कि कई प्रोटॉन और न्यूट्रॉन वाले एक नाभिक को एक साथ रखने के लिए ऊर्जा लगती है, विखणडन बम इस सिध्थान्त पर काम करता है कि कई प्रोटोन और नूट्रोन वाले एक नाभिक को एक साथ रकने के लिए उर्जा लगती है
33,ऐसा माना जाता है कि पेरिस के निवासी अहंकारी असभ्य और अभिमानी होते हैं, एसा माना जाता है कि पैरिस के निवासी अहांकारी असबदे और अभिमानी होते हैं।
34,1963 में बांध बनने के बाद मौसमी बाढ़ जो पूरे नदी में तलछट फैला देगी वह रुक गई थी, 1963 में बाद बनने के बाद मौसमी बार जो पूरे नदी में थल्चट फेला देगी वे रुप गई थी।
35,यह ऑरोरा बोरेलिस को देखने का एक अच्छा अवसर प्रदान करता है क्योंकि आकाश में उस समय अंधकार सा ही रहेगा, यह आरोरा बोरेलिस को देखने का एक अच्छा अवसर प्रधान करता है क्यूकि अकाश में उस समय अंदकार साही रहेगा
36,यह शहर देश के बाकी शहरों से अलग है क्योंकि यह किसी अफ्रीकी शहर की बजाय अरब शहर लगता है, यह शहर देश के बाकी शहरों से अलग है क्यूकि यह किसी अफ्रीकी शहर की बजाए अरब शहर लगता है
37,पुलिस अधीक्षक चंद्र शेखर सोलंकी ने कहा कि आरोपी ढके हुए चेहरे के साथ अदालत में पेश हुए थे, पूलिस अदीच्चक चंद शेकर सोलंकी ने कहा कि आरूपी धाके हुए चह्डे के साथ अजालस में पेश हुए थे।
