,reference,transcription
76,कोई सुनामी की चेतावनी जारी नहीं की गई है और जकार्ता भूभौतिकी एजेंसी के अनुसार कोई सुनामी की चेतावनी जारी भी नहीं की जाएगी क्योंकि भूकंप 6.5 की आवश्यकता को पूरा नहीं करता था, कोई सुनामी की चिथावनी जारी नहीं की गई है और जकाता बुपोतद की एजन्सी के shown us court did not dependence on the agents of desparation in Jakarta. कोई सुनामी की चिथावनी जारी नहीं की जैगी किवंकी catalogue of handle of Bookom 6.5 खिर इए-एवेशक्ता ठा हु पूरा नहीं करता था आपका आपका आपका आपका आपका आपका आपका आपका आपका आपका आपका आपका आपका आपका आपका आपका आपका आपका आपका आपका आपका आपका आपका आपका आपका आपका आपका आपका आपका आपका आपका आपका आपका आपका आपका आपका आपका �
77,अंत में कई ऐसी छोटी बिल्लियाँ लूज़ पेट कैट्स सहित हैं जो कीट रोडंट्स छिपकलियों और पक्षियों जैसे कई छोटे जीवों को खाती हैं," अन्त में कई ऐसी चोटी बिल्लियां लूस पेट कैट्स सहिथ हैं जो कीट, रोडन्स, चिपकलियों और पक्षियों जैसे कई चोटे जीवों को खाती हैं."
78,सामान के ट्रांसपोर्ट के लिए जहाज़ों का इस्तेमाल करना समुद्रों के एक सिरे से दूसरे सिरे तक बड़ी मात्रा में लोगों और सामान को लाने और ले जाने का बहुत ज़्यादा प्रभावी तरीका है," शामान के ट्रास्फोट के लिए जहाजों का इस्तमाल करना, समुद्रों के एक सीरे से दूसरे सीरे तक बढ़ी भात्रा में लोगों और शामान को लाने और ले जाने का बहुत स्यादा प्रभावी तरीका है।"
79,जिसके परिणामस्वरूप मंच पर कलाकार गांजे भरी सिगरटें पीते हैं और ये थिएटर खुद दर्शकों को भी इसमें साथ शामिल होने के लिए प्रेरित करते हैं, जिसके परिनाम स्वरूप मंच पर कालाकार गांजे भरी सिग्रेट पीते हैं और ये थियेटर खुद दर्शकों को भी इसमें साथ शामिल होने के लिए प्रेरित करते हैं
80,अगर आपने फ़िल्म नेशनल ट्रेज़र देखी है तो आपको लगेगा कि स्वतंत्रता के घोषणा-पत्र के पीछे एक ख़ज़ाने का नक्शा लिखा गया था," अगर आपने फिर्म नेशनल ट्रेजर देखी हैं, तो आपको लगेगा कि सॉतन्सा के भूश्ना पत्र के पीछे एक खजाने का नक्षा लिखा गया था।"
81,कहा जाता है कि वह 20 साल की उम्र में ही जीर्ण हो गया था एक बयान में बीबर ने कहा हांलांकि मैं मौजूद नहीं था और न ही सीधे इस दुखद दुर्घटना से जुड़ा हुआ था मेरी संवेदनाएं और प्रार्थनाएं पीड़ित के परिवार के साथ हैं, कहा जाता है कि मैं 20 साल की अमर में ही जीलन हो गया था एक बयान में बीबर ने कहा हाला की मैं मौजूद नहीं था और नहीं सीदे इस दुकद्धुर गत्ना से जुला हुआ था मेरी सम्वेडनायं और प्रात्नायं पीलित के परिवार के साथ हैं
82,यह संबंधित है लेकिन आम तौर पर इसमें अल्पाइन शैली की स्की टूरिंग या माउंटेनीयरिंग शामिल नहीं होती है जिसे खड़े इलाकों में किया जाता है और जिसके लिए बहुत कड़ी स्की और बूट की ज़रूरत होती है, अपना सम्मन्तित है लेकिन आम तुप्परुश ने अल्पाइंच रिकिस की तुइन या मार्फ तेन येलिन सामिर्योना की जिसके खडिला को में किया जाता है तुइन जिसके लिए वो खडिस की लगडित की जुरूता है तुइन
83,बेशक इस परंपरा के पीछे ईसाई धर्मशास्त्र के स्पष्टीकरण दिए जाते हैं लेकिन एक प्री-क्रिश्चयन स्प्रिंग और फ़र्टिलिटी रस्म भी हो सकती है, बेशक इस परमबरा के पीचे इसाइ धरम शास्तर के स्पर्ष्टी करन दिये जाते हैं लेकिन एक pre-Christian spring और fertility रस्म भी हो सकती हैं.
84,जो भी ऊंचाई या पहाड़ी दर्रे पर गाड़ी चलाने जा रहा है उसे हिम बर्फ या ठंड के तापमान की संभावना के विचार को मन में रखना चाहिए," जोबियों चाहिया पाहारी दर्रे पर गाड़े चलाने जारा है, उसे हिम बर्फ या थंड के ताब मान के समभावना के विच्यार को मन में रकना चाहिये."
85,"हालांकि लगभग रातों-रात इन योजनाओं को तब बनाया गया था जब सोवियत की यूनियन रेड आर्मी के 800,000 से ज़्यादा सैनिकों ने पोलैंड के पूर्वी क्षेत्रों पर हमला करने के बाद प्रवेश करते हुए बेलारूसी और यूक्रेनी मोर्चे खड़े कर दिए थे उन्होंने यह रिगा शांति संधि द सोवियत-पॉलिश नॉन-एग्रेशन पैक्ट और अन्य अंतरराष्ट्रीय द्विपक्षीय और बहुपक्षीय दोनों तरह की संधियों का उल्लंघन करते हुए किया था"," हाला की लगवग रातो रात इन योज़नाओं को तब बनाय गया था जब सोवियत की यूनियन रेड आर्मी के 8 लाक से ज्यादा सैनिकों ने पूर्वीक शित्रों पर हामला करने के बाद प्रवेश करते हुए बेलारूसी औ युक्रेनी मोर्चे कर दिये थे। उन्होंने ये रीगा शान्ती संदि, The Soviet Polish Non-Igration Pact और अन्य अंतरअस्टरिदवे पक्षिय और भहुपक्षिय दोनो तरा की संदियों का वलंगन करते हुए किया था।"
86,वहीं स्पेक्ट्रम का दूसरा सिरा कोई व्यक्ति किसी ऐसे अपिरिचित व्यक्ति का रूप लेता है जिसे लगता है कि उसे टीम में सब कुछ बदल देना चाहिए और उसे अपने हिसाब से बनाना चाहिए, वही spectrum का दूसरा सिरा कोई वेक्ति किसी ऐसे अपरचिद वेक्ति का रूप लेता है जिसे लक्ता है कि उसर तीम में सब कुछ बदल देना चाहिये और उसे अपने हिसाब से बनाना चाहिये
87,किया गया अधिकांश काम सैद्धांतिक था लेकिन सैजिटेरियस गैलेक्सी से बने ऑब्ज़र्वेशन को सिम्युलेट करने के लिए प्रोग्राम को लिखा गया था, किया गया अधकार्ज काम सैथ दाम्तिक था लेकिन सैजितेलियस ग्लैक्सी से बने अब्जर्वेशन को सिमिलियेट करने के लिए प्रोग्राम को लिखा गया था
88,गंभीर मौसम किसी भी खतरनाक मौसमी घटना के लिए वर्गीय शब्द है जिसमें नुकसान गंभीर सामाजिक व्यवधान या मानव जीवन की हानि की संभावना है," गंबीर मौसम किसी भी खतरनाक मौसमी खतनाओ के लिये वर्गिय शब्द है, जिसमे नुक्सान गंबीर सामाजिक व्यवदान या मानव जीवन की हानी की सम्भावना है।"
89,अलगाव और पुनर्संयोजन भिन्नता प्रत्येक पीढ़ी के साथ दो पूलों के बीच आगे-पीछे होती रहती है, अल्गाव और पुनर सञ्युजन बिन्नता प्रत्तिक पिडि के साथ दो पूलो के बीज आगे पीज़े होती रहती हैं।
90,पौधों से सबसे आसानी से मिलने वाले संसाधनों में पत्तियों और फलियों में मिलने वाले प्रोटीन होते लेकिन हम जैसे प्राइमेट्स के लिए उसे पकाए बिना पचाना मुश्किल होता है, पोदों से सबसे आसानी से मिलने बाले संसादवन में पत्तियों और फ़डियों में मिलने बाले प्रुटिन होते लेकिं हम जैसे प्राइमेल्ट्स के लिए उसे पकाय बिना पचाना मुस्किल होता है
91,लेकिन भूमध्य रेखा के कुछ ही डिग्री उत्तर में मौजूद  अत्यधिक उष्णकटिबंध” में होने की वजह से आपको गर्मी हमेशा और तेज़ धूप जब आसमान साफ़ हो जो कि ज़्यादातर होता है का सामना करना पड़ेगा, लेकिन भूमदिरेखा के कुछी दिग्री उत्तर में मौजूद अत्यदेक उश्ण कर्टिबंद में होने की वजह से आपको गर्मी हमेशा और तेज धूब जब आसमान साफ हो जो की जादतर होता है का सामना करना पढ़ेगा
92,पौधे फ़ोटोसिंथेसिस द्वारा सूर्य से अपना भोजन बनाते हैं वह छाया भी देते हैं, पौदे फोटो सिन्तेसिस द्वारा सुरे से अपना भुजर मनाते हैं वा च्हाया भी देते हैं।
93,जियानकार्लो फिशिचेला ने अपनी कार पर नियंत्रण खो दिया और शुरू करने के कुछ समय बाद ही दौड़ समाप्त कर दी, जियान कार्लो फिशी चेला ने अपनी कार पर नियंटरं खो दिया और शुरू करने की कुछ समय बाद ही दोर समाबत कर दी
94,साई के साथ-साथ सभी संज्ञा शब्द हमेशा अंग्रेज़ी के बड़े अक्षर से ही शुरू होते हैं भले ही वे वाक्य के बीच में ही क्यों न हों," साइ के साथ साथ सभी संग्या शब्द हमेशा अंग्रीजी के बढ़े अक्षर से ही शुरू होते हैं, बली ही वे वाग्के के बीच में ही क्यो नहों."
95,1889 में यह बंदरगाह कुख्यात नौसैनिक गतिरोध का ठिकाना था उस समय जर्मनी अमेरिका और ब्रिटेन के सात जहाजों ने इस बंदरगाह से जाने से इनकार कर दिया था," 1889 में यह बंदर्गाक युख्यात नोसेनिक गतिरोत का थिकाना था। उस समय जर्मनी, अमेरिका और बिटन के साथ जहा जोने इस बंदर्गाक से जाने से इनकार कर दिया था।"
96,अमेरिकी जिमनास्टिक्स संयुक्त राज्य ओलंपिक समिति के पत्र का समर्थन करता है साथ ही सभी एथलीटों को एक सुरक्षित माहौल देने के लिए ओलंपिक परिवार के होने की अहमियत स्वीकार करता है, अमेरिकी जिम्नास्टिक संयूप्त राज उलम्पिक समेती के पड्र का समर्थन करता है साथ ही सभी अथलीटों को एक सुरच्चित माहूल देने के लिए उलम्पिक परिवार के होने की अहमियत को शुखार करता है
97,यह कहते हुए कि वे चीन के आर्थिक उत्पादन के आधार पर बनाए जाएंगे उन्होंने कटौती के लिए कोई आंकड़ा निर्धारित नहीं किया, यह कहते हुए वे चुन के आर्थिक उत्पादन के आजाद पर बनाए जाएंगे। उनोंने कटौति किल्ले कोई आक्डा निर्जादित नहीं किया।
98,ये ज़्यादातर रेत के तट हैं जहां तैरना सुरक्षित माना जाता है इनमें से ज़्यादातर में पोहुकुटावा पेड़ों की छाया रहती है, ये जादातर रेत की तट्हे जहां तेरना सुरक्षित माना जाता है। इनमें से जादातर में पोहु कुडबा पेडो की चापा रहती है।
99,यह शहर अफ़्रीका के कुछ सबसे सस्ते पहाड़ी गोरिल्ला ट्रेकिंग के साथ ही नायरागोंगो ज्वालामुखी की चढ़ाई करने का बेस भी है, योषर अफ्रीका के कुछ सब से सस्ते पारी गोरिला ट्रेकिंग के साथ ही नारा गोंगो जौला मुखी की चढ़ाई करने का बेज भी है।
100,मध्य युग के अंत में पश्चिमी यूरोप ने अपनी शैली विकसित करना शुरू कर दिया धर्मयुद्ध के परिणामस्वरूप उस समय के सबसे बड़े विकास में से एक लोगों ने कपड़ों को बांधने के लिए बटन का उपयोग करना शुरू किया, मद्ययूक के अन्त में पष्चिम यूरोप ने अपनी शैली विक्सित करना शुरू कर दिया है धर्म यूत के पढ़न्नाम स्वरूप उस समय के सबसे बड़े विकास में से एक लोगों ने कपुडों का बाद दिने के लिए बटन का उप्योग करना शुरू किया
101,शेर प्राइड नामक बड़े समूहों में रहने वाली सबसे बड़ी सामाजिक बिल्लियां हैं, सेर प्राइड नाम के बड़ा समू में रहने वाली सबसे बड़ी सामाजिक बिल्लिया है।
102,उनके पैरों में पपड़ियां और पंजे हैं वे अंडे देते हैं और वे किसी टी-रेक्स की तरह अपने दो पीछे वाले पैरों पर चलते हैं," उनके पैरों में पपडियां और पंजे हैं, वे अंडे जेते हैं और वे किसी टीरेक्स की तरह अपने दो पीछे वाले पैरों पर चलते हैं."
103,अगर आपने फ़िल्म नेशनल ट्रेज़र देखी है तो आपको लगेगा कि स्वतंत्रता के घोषणा-पत्र के पीछे एक ख़ज़ाने का नक्शा लिखा गया था," अगर आपने फिल्म नैशनल ट्रेजर देखी है, तो आपको लगेगा कि सवतनतरता के पूषना पत्र के पीचे एक खजाने का नक्षा लिखा गया था."
104,लड़ाई के आख़िरी दो सालों में पहले के साथी अब दुश्मन बन गए थे और शीत युद्ध की शुरुआत हो चुकी थी, लड़ाई के आख्री दो सालो में पहले के साथी अब दिश्बन बन गय थे और शेती यूद्ध की शुरूआत हो छुकी थी।
105,यह वह जगह है जहां ब्रिटिश उपनिवेशवादियों ने अपना बनाया और इसलिए अगर आप इस जगह के औपनिवेशिक अतीत के सबूतों को ढूंढ रहे हैं तो यह एक अच्छी जगह है," ये वे जगा है जहां ब्रितिश उप्निवेश वादियू नि अपना बनाया और इसलिए अगर आप इस जगा के उप्निवेशिक अतीद के सबूतो को डुनड रही हैं, तो ये एक अच्छी जगा है।"
106,आप गोमा के आस-पास घूमने के लिए बोडा-बोडा मोटरसाइकिल टैक्सी ले सकते हैं. छोटी सैर के लिए आम तौर पर स्थानीय किराया करीब 500 कांगोलीज़ फ़्रैंक लगता है, आप गोमा के आसपास बुमने के लिए बोड़ा बोड़ा मोटर साइकल टैक्सी ले सकते है जोटी सहर के लिए आमतर पर स्थानिय किराय करिप पान्सो कांगलोलिज फ्रेंक लगता है
107,आमतौर पर आप हमेशा पर्यटकों और बेचने वालों की आवाज़ सुनते हैं ध्वनि और प्रकाश की कहानी स्टोरी बुक जैसी है," आम तौर पर आप हमेशा परेटपों और भीचने वालों की अवाज सुनते हैं, धवनी और प्रकाश की कहानी स्टोरी बॉब जैसी हैं."
108,यातायात बहाव दो बिंदुओं के बीच व्यक्तिगत चालकों और वाहनों की गतिविधि और एक दूसरे के साथ की जाने वाली पारस्परिक क्रिया का अध्ययन है, याता यात बहाव दो बिंदूं के बीज वेक्तिगत चालकों और वाहनों की गतिविदी और एक दुसरे के साथ की जाने वाली परस्परिक क्रिया का अधिहयन है।
109,यूएसए जिमनास्टिक्स और यूएसओसी का एक ही लक्ष्य है एथलीटों को सुरक्षित सकारात्मक और सशक्त वातावरण में अपने सपनों का अनुसरण करने के लिए जिमनास्टिक्स और अन्य लोगों के खेल को जितना संभव हो सके उतना सुरक्षित बनाना," USA GYMNOSTIX और USOC का एक ही लच है। अथलीटों को सूरच्छित, सकाराथमक और शशकत वातावराण में अपने सपनों का अनुष्णरन ये के लिए जिम्नाअस्टिक्स और अन्ने लूगों के खेल को जितना समवह हो सके उतना सूरच्छित बनाना।"
