,reference,transcription
191,"माना जाता है कि ईरान की ज़ाग्रोस पहाड़ियों में 10,000 साल पहले बकरी पालन की शुरुआत हुई थी"," माना जाता है कि इरान के जाग्रुश पाहडियों में 10,000 साल पहले बक्रिपालान की सुरूबात होई थी।"
192,अधिकांश छोटे द्वीप स्वतंत्र राष्ट्र हैं या फ़्रांस से संबंधित हैं और लग्ज़री बीच रिसॉर्ट के रूप में जाने जाते हैं, अधिकाज चोटे द्वी पस्वतंत्र राश्टर हैं या फ्रान्स से सम्बंदित हैं और लग्स्री बीच्स रेजोर्ट के रूप में जाने जाते हैं।
193,उनका काम ऐसी गुणवत्ता और विस्तार के पहचान का है कि वह टिकट संग्रहकर्ताओं के बीच बहुत कम घरेलू नामों में से एक है कुछ उनके काम को अकेले बटोरने में माहिर हैं, उनका काम एसी गुन्वता और बिस्तार के पहचान का है कि वह टिकेट संग्रह करताओं के बीच बहुत काम घरे लूनामोल्ड में से एक है कुछ उनके काम को अकेले बटरने में माहिर है
194,1537 में असूनचिओन की स्थापना के बाद से पैराग्वे अपने स्वदेशी चरित्र और पहचान को बनाए रखने में कामयाब रहा है, 1537 में असून चीओन की स्थापना के बाज से पैरागवे अपने स्वदेशी चरित्र और पैछान को बनाय रखने में काम्याब रहा है।
195,दुर्घटना के बाद गिब्सन को अस्पताल पहुंचाया गया लेकिन कुछ ही समय बाद उनकी मृत्यु हो गई, तुरगथना के बाद केपसन को असपताल पौछाया गया लेकिन कुछ ही समय बाद उनकी मृत्ती हो बई।
196,ब्लॉग से छात्र लेखन में सुधार करने में भी मदद मिल सकती है जहां छात्र अपने ब्लॉग अनुभव की शुरुआत अक्सर बेतरतीब व्याकरण और वर्तनी के साथ करते हैं वहीं दर्शकों की मौजूदगी से इसमें आम तौर पर बदलाव आता है, ब्लॉग से चात्र लेकहन में सुद्धार करने में भी मदत मिल सकती हैं। जहां चात्र अपने ब्लॉग अनभहग की शुरूआत अकसर बेतर्ती व्याक्रन और वर्तनी के साथ करते हैं। वहीं तर्षकों की मौजूदकी से इस में आम तोर पर बद्लाव आता है।
197,डुवैल जो विवाहित है और उसके दो वयस्क बच्चे हैं उसने मिलर पर बड़ा असर नहीं किया जिस से कहानी संबंधित है," दुवेल जो विवाहित है और उसके दो वैसक बच्चे है, उसने मीलर पर बड़ा असर नहीं किया, जिससे कहानी सम्हंदित है।"
198,प्रदर्शन चालू होने के पाँच मिनट में हवा शुरू हो जाती है लगभग एक मिनट बाद हवा 70 किमी/घंटा तक पहुँच रही है... फिर बारिश आती है लेकिन इतनी तेज़ और इतनी बड़ी बूँदें कि यह आपकी त्वचा को सुई की तरह चुभती है फिर आकाश से ओले गिरते हैं लोग घबराते हैं चिल्लाते हैं और अफरातफरी मच जाती है।, प्रदर्शन चालू होने के पाज मिनड में हावा शुरू हो जाती है लगबाग एक अटा बाद हावा 70 किलोमेटर प्रति अटा तक पहुछ रही है फिर बारिश आती है लेकिन इतनी तेज और इतनी बड़ी बूदें किया आपकी तुचा को सूए की तरह चुभाती हैं फिर
199,रोलैंडो मेंडोज़ा ने अपनी m16 राइफल से पर्यटकों के ऊपर फायर किया, वो लोग नहीं दो ज़ाना पूँ भार्शिक्टों राइफ़ाइं के फ़री पुःपूँ कोई पाइडिया।
200,रोम में अलग-अलग जगहों पर कई बड़े टेलीविज़न स्क्रीन लगाए गए ताकि लोग समारोह देख सकें, रोम में अलग-अलग जगा पर कई बढ़े टेलिविजन स्क्रिन लगा गये थाकि लोग समारह देख सकें।
201,पिछले हफ्ते meti ने घोषणा की कि apple ने 34 ओवरहीटिंग के मामले सामने आये है  जिसे कंपनी ने गंभीरता से नहीं लिया ।, पिछले हफते METI ने गोश्णा की कि Apple ने चोंक्तिस ओवर हिटिंग के मामले सामने आये हैं जिसे कम्पनी ने गमभीरता से नहीं लिया।
202,मस्तिष्क विकृति और व्यवहार के बीच संबंध अनुसंधान में वैज्ञानिकों का समर्थन करते हैं, मस्तिश विक्रिती और व्यवार की भीच समबंद अनुसन साधन और वैज्ञानिकों का समर्तिन करते हैं
203,कंफेडेरशन के अनुच्छेद के तहत क्रांतिकारी युद्ध के दौरान तेरह राज्यों ने पहली बार एक कमजोर केंद्रीय सरकार का गठन किया जिसमें कांग्रेस इसका एकमात्र घटक थी," Confederation के अनुच्षेत के तहत करान्तिकारी यूध्ध के दौरान, 13 रज्यों ने पहली बार एक कम्जूर केंदरी सरकार का गथन किया, जिसमे कौंग्रेस इसका एक मात्र घटक थी."
204,बच्चों को कई वजहों से फ़ॉस्टर केयर में रखा जाता है जिनमें अनदेखी करना बुरा बर्ताव करना और यहां तक कि ज़बरदस्ती वसूली करना भी शामिल है," बच्छों को कही वजहों से पास्टर केरियर में रखा जाता है जिन में अंदेखी करना, बौरा बर्दाव करना और यहां तक की जबर्दस्ती वसूली करना वी शामिल है।"
205,यूरोप एक ऐसा महाद्वीप है जो अपेक्षाकृत छोटा है लेकिन इसमें कई स्वतंत्र देश हैं सामान्य परिस्थिति में कई देशों की यात्रा करने का मतलब कई बार वीज़ा आवेदन और पासपोर्ट कंट्रोल की प्रक्रिया से गुज़रना है," यूरूब एक ऐसा महादिफ है जो अपेक्षा क्रित चोटा है लेकिन इस में कई साथन्तर देश है साममन्य परिस्थिति में कई देशो की आयात्र करने का मतलब कई बा विजा, अवेजन और पार्सपृट कुंट्रोन की प्रक्रिया से गुजरना है।"
206,वैज्ञानिकों को यह समझने की उम्मीद है कि ग्रह कैसे बनते हैं खासकर पृथ्वी कैसे बनी चूंकि धूमकेतु पृथ्वी से बहुत पहले टकरा चुके थे, वैग्जानिकों को यह समझने की उमीद है कि ग्रह कैसे बनते हैं खासकर प्रित्वी कैसे बनी जो कि दुम केतू प्रित्वी से बहुत पेले टक्रा जुकित हैं
207,टेलीविजन रिपोर्टों में प्लांट से निकलने वाला सफेद धुआं दिखाया गया है, तेरीवेजन रिपोटो के में प्लांट में निकाल ले जाने वाल्या सफे दूआ तिखाया गया है।
208,पुलिस अधीक्षक चंद्र शेखर सोलंकी ने कहा कि आरोपी ढके हुए चेहरे के साथ अदालत में पेश हुए थे, पूलीस अधिक्षक चंदर शेखर सोलंकी ने कहा कि आरोपी धके हुए चहरे के साथ अदालक में पेश हुए थे।
209,रूमानियत में सांस्कृतिक नियतिवाद का बड़ा तत्व था जो गोएथे फिच्ते और श्लेगल जैसे लेखकों से लिया गया," रुमानियत में सांस्कृतिक नियतिवाद का बड़ा महत्व थां जो गुई थे, फिच्ते और स्लेकल्जे से लेक्खों से लिया गया।"
210,उपग्रह को एक रॉकेट से अंतरिक्ष में भेजा गया था वैज्ञानिक अंतरिक्ष में दूरबीनों का उपयोग करते हैं क्योंकि पृथ्वी का वायुमंडल हमारे कुछ प्रकाश और दृश्य को अशुद्ध करता है," अबग्रह को एक रोकेट से अंत्रिक्ष में भीजा घया था, वैग्यानिक अंत्रिक्ष में दूरबीनों का उप्योक करते हैं क्योकि प्रिछ्वे का वायोमंडल हमारे कुछ प्रकाश और द्रिशिक को अशुद कर सकता हैं."
211,जितनी कम चिंता उतनी ज़्यादा सकारात्मक जीवन ऊर्जा का संचार हर इंसान परम शांति और संतोष पा सकता है," जितनी कम चिन्ता, उतनी ज्यादा सकरात्मक जीवन उर्जा का संचार। हर इंसान परमशान्ती और संतोश पा सकता है।"
212,बीसवीं सदी के शोध से पता चला है कि आनुवंशिक भिन्नता के दो पूल हैं छुपा हुआ और अभिव्यक्त, बीसवी सदी के सोद से पता चला है कि अनुवन्षिक अभिन्नेता को दो पुल हैं चुपा हुआ और अभी वियक्त.
213,स्कीइंग मार्ग को एक हाईकिंग लंबी पैदल यात्रा मार्ग जैसा ही सोचें।, अस्कीन्मार को एक हाईकिंग मतलब लंबी पेदल याद्रा मार्ग जेजा ही सूचे.
214,बच्चों को कई वजहों से फ़ॉस्टर केयर में रखा जाता है जिनमें अनदेखी करना बुरा बर्ताव करना और यहां तक कि ज़बरदस्ती वसूली करना भी शामिल है," बच्छों को कई वजहों से फॉस्टर केर में रखा जाता है, जिन में अंदेखी करना, बौरा बरताओ करना, और यहां तक की जबर्दस्ती वसूली करना भी सामिल है।"
215,एंटरटेनमेंट न्यूज़ वेबसाइट tmz का मानना है कि फ़ोटोग्राफर ने अपना वाहन सेपुलवेडा बुलेवार्ड की दूसरी तरफ रोका था और सड़क पार करने और जारी रखने से पहले पुलिस स्टॉप की फ़ोटो लेने की कोशिश की कैलिफोर्निया हाईवे पेट्रोल पुलिस अधिकारी ने ट्रैफिक स्टॉप का संचालन करते हुए उसे रोकने के लिए दो बार आदेश दिया, Entertainment news website TMZ का मानना है कि photographer ने अपना वाहन Super Veda Boulevard की दूसरी तरफ रोका था और सड़क पार करने और जारी रखने से पहले Police stop की फोटो लेने की कोशे शिक की California Highway Patrol कोर पोलिस अदिकारी ने traffic stop का संचालिं करते उसे रोकने के दो बार आदेज दिया
216,यह रिपोर्ट इराक के प्रति प्रशासन की वर्तमान नीति के लगभग सभी पहलुओं के प्रति बेहद आलोचनात्मक है और यह इसकी दिशा में तत्काल परिवर्तन का आग्रह करती है, या रिपूट इराख के प्रति प्रसासन की वर्तमा निटी के लगभक सभी पहलूओं के प्रति बेहद आलुश्नात्मक है और या इसकी दिशामे ततकाल पर्वर्तन का आग्र करती है।
217,प्राकृतिक वातावरण में पौधे सबसे अच्छे दिखते हैं इसलिए सिर्फ एक नमूने को भी हटाने के प्रलोभन को रोकें," प्राक्रुतिक बातावर में पोड़े सबसे अच्छे दिखेते हैं, इसलिए सिर्फ एक नमुने को भीए हटाने के प्रलोबन को रोके."
218,मार्टेली ने कल नौ सदस्यों के एक नए अनंतिम चुनाव परिषद cep में शपथ ली, मार्टेली ने कल नो सदस्यों की एक नहीं अन्तिम चुना परिशद CEP में शपत ली।
219,"हालांकि टुबर्क्युलोसिस वाले लोगों के पूरे समूह में एक्सडीआर-टीबी का प्रतिशत अभी भी कम है दक्षिण अफ़्रीका में किसी भी विशेष समय पर कुल 330,000 लोगों में से 6,000 संक्रमित हैं"," हालांके तुर्बकौलेसिस वाले लोगों के पूरे समुन में XDR-TV का प्रत्सत अभी भी कम है, दक्छिन अफरीका में किसी भी भी से समय पर कुल 3,30,000 लोगों में से 6,000 संक्रमित हैं।"
220,ओलिवर सैक्स ने अपने पेपर द प्रेसिडेंट स्पीच में संकेत दिया कि कैसे जो लोग दिमागी नुकसान के कारण भाषण को समझ नहीं पाते हैं फिर भी वे ईमानदारी का सही आकलन कर पाते हैं," अलिवर् सैक्ष ने अपने पेपुर दा पैसिडेंट इस्पीच में संकेट दिया कि कैसे जो लोग दिमाजी नुक्सान के कारण भासर को समझ नहीं पाते हैं, फिर वे इमांदारी का सही आकलिन कर पाते हैं।"
221,जैसे-जैसे ग्रीक का ज्ञान घटता गया पश्चिम ने खुद को अपनी ग्रीक दार्शनिक और वैज्ञानिक जड़ों से कटा हुआ पाया," चेसे जे से ग्रीक का ग्नान गत्ता गया, बस्चिम ने खुद को अपनी ग्रीक दर्सनिक और विग्नानिक जडो से कटा हुआ पाया।"
222,सामान के ट्रांसपोर्ट के लिए जहाज़ों का इस्तेमाल करना समुद्रों के एक सिरे से दूसरे सिरे तक बड़ी मात्रा में लोगों और सामान को लाने और ले जाने का बहुत ज़्यादा प्रभावी तरीका है, सामान के ट्रानस्पोट के लिए जहाजों का इस्तमाल करना समुद्रों के लिए एक सिरे से दूस्रे सिरे तक बड़ी मात्रा में लोगों और सामान को लाने और ले जाने का बहुत ज्यादा प्रवहभी तरीका है।
223,प्लिटवाइस नेशनल पार्क घने जंगल से घिरा है जहां मुख्य रूप से बीच स्प्रूस और फ़र के पेड़ लगे हुए हैं और यहां अल्पाइन और भूमध्य वनस्पति मिलती हैं," प्लिट्वाइस नाश्णल पार्ग घने जंगलों से खेरा है, जहां मुक्के रूप से बीज, स्प्रूस और फर्ग के पेड लगे हुए हैं, और यहां अल्पाइन और भूम अदिवनस्पती मिलती हैं."
224,लेकिन उन पक्षियों के बारे में बहुत सी चीजें हैं जो अभी भी डायनासोर जैसे दिखते हैं, लिकिन उन पक्षियों के बारे में भूहत सी जीसे हैं जो अभी भी डयनोसॉर जैसी दिखती हैं।
225,लीक के अनुसार दस्तावेज़ सीमा विवाद को संदर्भित करेगा जो फ़िलिस्तीन 1967 के मध्यपूर्व युद्ध से पहले सीमाओं के आधार पर चाहता है, लेक के अनुसाद तस्तावेश सीमा विवाद को संदरबित करेगा जो फिलिस्थीन 1967 के मद्यपूर्व यूद से पहले सीमाों के आधार पर चाता है।
226,रोम में अलग-अलग जगहों पर कई बड़े टेलीविज़न स्क्रीन लगाए गए ताकि लोग समारोह देख सकें, रोम में अलग-अलग जगहों पर कई बढ़े टेलीवीजन स्क्रीन लगाए गए ताकि लोग समारो देख सकें।
227,यह डिवाइस को हवा में मूव करके खिलाड़ियों को एक्शन और मूवमेंट कंट्रोल करने की अनुमति देगा, यह दिवाइस को हवा में मूव करके खिलाडियों को एक्षन और मूबेंट कंट्रोल करने के अनुमती देगा।
228,हालांकि शेंगेन ज़ोन इस मामले में कुछ हद तक एक देश की तरह काम करता है, हालाकि शिंगेन जोन इस मामले में कुछ हाथ तक एक देश की तरा काम करता है
229,अपनी सरकार के अलावा आप अन्य देशों की सरकारों की सलाह ले सकते हैं हालांकि उनकी सलाह उनके नागरिकों को ध्यान में रखकर दी जाती हैं, अपनी सर्कार के अलावा आप अन्ने देशु की सर्कारों की सला ले सकते हैं हाला की उनकी सला उनके नाद्रिकों को द्यान में रख कर दी जाती हैं
230,उनकी अनुशासित रक्षा गेंदबाजी की कला और टीम के अच्छे काम ने उन्हें बाहर खड़ा कर दिया और अब यह साफ हो गया था की ये टीम टक्कर देगी," उनकी अनशासित रक्षा, गेनभाजी की कला और टीम के अच्छे काम ने उन्हें बार खड़ा कर दिया और अब यह साफ हुगया था कि ये टीम तककर देखी।"
