,reference,transcription
502,जरी एक प्रायोगिक लस इबोलाचा मृत्युदर कमी करू शकली असली तरी आतापर्यंत कोणतेही औषध आधीच झालेल्या संसर्गाला योग्यरित्या लागू पडलेले नाही, जर एक प्रायोगिक लस ईबोलाचा मृत्यूदर कमी करूशकली असली तरी आत्ता परिंद कौन तेही आउशद आदीच जालेला संसुर्गालाय गिरते लागू पडलेले नाही।
503,ते अनेक देशांच्या नोटांच्या कोरीव कामात देखील व्यस्त होते नवीन कॅनेडियन $5 आणि $100 बिल्सच्या अग्रभागी असलेले पंतप्रधानांचे पोर्ट्रेट हे त्यांच्या अलीकडील कामाचे उदाहरण आहे, ते अनेक देशांचा नोटांचा कोरिव कामाद देखिल व्यस्त होते। नवीन कैनेडियन डॉलर फाई आणी शंभर डॉलर बिल्स चा अग्रभागी असलेली पंत प्रधानांचे पोर्ट्रेट हे त्यांचा अली कडिल कामाचे उदाहरण आहे।
504,"""कॅटरीना चक्रीवादळाच्या पार्श्वभूमीवर मदत आणि पुनर्रचनेसाठी खर्च केल्याच्या वादामुळे या चर्चेला सुरुवात झाली; काही आर्थिक पुरातनमतवादींनी यास ""बुश यांचा न्यू ऑर्लीयन्स करार"" असे विनोदी नाव दिले आहे.", क्याट्रिना चक्रिवादलाच्या पार्शुगों और बदातानी पुरान पुनार रचने साथी खर्च केलेच्या वादा मुळे या चेर्चेला सुर्वा धली। कही अर्थिक पुरातन मत्वादेनी याज बुश्यांचा न्यू ओलियंस करारसे विनो दिना दिल्याही।
505,मुलांमध्ये केवळ नवीन पेशींमध्ये बदल घडवून आणला जाऊ शकतो तर इतरत्र उत्परिवर्तन केल्यास पेशी-नष्ट होऊ शकतात किंवा कर्करोग होऊ शकतो," मुलाम मद्दे केवल नवीन पेशी मद्दे बदल गड़वुन आनला जाऊ शक्तो, तर इतरत्र उत्परिवर्तन केल्यास पेशी नष्ट होँ शक्तात किवा करकुरोग होँ शक्तो।"
506,दूरदर्शनच्या अहवालांमध्ये झाडांमधून पांढरा धूर येत असल्याचे दाखविले आहे, दूर दर्शनाच्या अहवालान मधिये जाडान मधुन पांड्रा दूर येत असलेयाचे दाखविले आहे।
507,विश्वातील प्रत्येक गोष्ट विशिष्ट प्रकारच्या द्रव्यापासून बनली आहे सर्व विशिष्ट प्रकारची द्रव्ये अणू नावाच्या अतिसुक्ष्म कणांपासून बनलेली असतात, विश्वातीर प्रत्तेगोष्ट विशिष्ट प्रकाच्य द्रव्या पासुन बंदल्याई सर्व विशिष्ट प्रकाच्य द्रव्या अनु नावाच्य अतिसुक्षमण कनाम पासुन बंदल्याली अस्तास्च।
508,झोपेतील व्यत्यत ही साधारण झोपेच्या कालावधीत मुद्दाम उठण्याची आणि काही काळानंतर १०-६० मिनिटांनी परत झोपण्याची प्रक्रिया आहे, जोपे तिल्वे वित्ते ही साधरन जोपे चे कालावेदेत मद्दा मुटनेची आनि काई काड़ान अंतर दा पुस्ते साट मिनिटानी पर जोपनेची परक्रिया ही।
509,"""डंडी विद्यापीठाच्या प्राध्यापक पामेला फर्ग्युसन यांनी नोंदवले की,""""पत्रकारांनी जर एखद्या संशयिताचा इत्यादी फोटो प्रकाशित केला तर ते धोकादायक रेषेवर चालत असल्यासारखे असते.""""", डंडी विद्यापिताच्य प्राध्यपक पामेल फर्गुसनेनी नंदलेकी पत्रकारन निजर एकादे सुन्शेताचा इत्यादी फोटो प्रकशित केला तर ते दोकादे करेशेवल सालत असले सरके असते
510,गळतीनुसार दस्तऐवज सीमा विवादास संदर्भित करेल जे पॅलेस्टाईनला 1967 च्या मध्ययुद्धापूर्वीच्या सीमांवर आधारित हवे आहे, गळती नसार दस्तावेच सीमा विवादास संदर्वित करेल जे पेलिस्टाइनलाई 1960 चा मद्य युद्धा पुर्वीचा सीमान वर आधरित हव्या ही।
511,अरिस्टॉटल या तत्ववेत्त्याने असा सिद्धांत मांडला आहे की सर्व काही 1 किंवा 4 पेक्षा अधिक मूलद्रव्यांनी बनलेले आहे ती मूलद्रव्ये पृथ्वी पाणी हवा आणि अग्नि होते," आरिस्टोटल या तत्ववेत्याने असा सिधान्त मनला है कि सर्वकाही एक किवा चार पेक्षा अधिक मूल द्रव्यानी बनलेलिया है। ती मूल द्रव्ये प्रत्वी, पाणी, हवा आणी अग्नी होते।"
512,स्थानांना प्रत्यक्ष भेट देणे हा वर्गशिक्षणातील फार मोठा भाग आहे अनेकदा शिक्षिकेला आपल्या विद्यार्थ्यांना अशा ठिकाणी न्यायचे असते जिथे बसने जाण्याचा पर्याय उपलब्ध नसतो, स्थानान्ना प्रत्यक्ष भेट देने हा वर्गक शिक्षणातिल फार मोठा भाग आही। अनेकदा शिक्षी केला अपल्या विद्यार्थ्यान्ना अशा ठिकानी न्यायचे अस्ते जिथे बसने जानेचा परियाय उपलब्ध नस्तो।
513,हे बुद्धिसंगत वाटते कारण पृथ्वीला ती फिरत असल्यासारखे वाटत नाही वाटते का," जे बुद्धी संगत वाटते कारण पूर्थे लाती फिर तसले साल के वाटत महे, वाटते का?"
514,अखेरीस अनेक लहान मांजरी आहेत स्वैर पाळीव मांजरींसह ज्या कीटक उंदीर सरडे आणि पक्षी यासारखे अनेक लहान भक्ष्य खातात, अखेरीस अनेक लहान मांजरी आहित। स्वेर पाल्यू मांजरीस जक्किटक उंदिर स्रडे अनी पक्षीया सरके अनेक लहान बक्षे खातात।
515,"""मागील आठवड्यात meti ने जाहीर केले की अॅपलने 34 अतिरिक्त ओव्हरहिटिंग घटनांची माहिती दिली होती ज्यास कंपनीने ""नॉन-सिरीयस"" असे म्हटले आहे.", मागिल आठवड्यात मेटी ने जाहिर केले की एपल ने 34 अतिरिक्त ओवर हीटिंग घटनांची माहिती दिली होती जास कंपनी ने नौन सीरियस असे मटले आहे
516,रहदारीचा प्रवाह हा २ बिंदूंमधील वैयक्तिक चालक आणि वाहनांची हालचाल आणि ते एकमेकांशी साधत असलेले संवाद यांचा अभ्यास आहे, रहधारी चा प्रवाह हा दोन बिन्दन मदिल वैक्तिक चालकानी वानांची हल्चालानी ते एगमे कांशी सादत असलेले सव्वाद्यांचा अभ्यासा है।
517,सगळ्या गोष्टी विचारात घेता जर आपल्याला कळले की आपले पूर्वज त्यांचा प्रथिनांचा प्रश्न सव्हानातील आजच्या चिंपँझीप्रमाणे सोडवत असत तर आपल्याला आश्चर्य वाटू नये, सगल्या गोष्टी विचारात गेता जर अपल्याला कलते की अपले पुरुवत त्यांच्या सुपर्तिनांचा प्रश्ण सावानातिल आच्छा चिम्पाजी प्रमाने सोड़त असेल तर अपल्याला अच्छर वाटो नहीं।
518,"1966 पासून सुंदरबन वन्यजीव अभयारण्य आहे आणि असा कयास आहे की इथे या भागात आत्ता 400 बंगाली वाघ आणि जवळपास 30,000 ठिपक्यांची हरणे आहेत", एकुनेशे सहा सश्ट पासून सुन्दर्बन वन्य जीव अभ्यारन्य आहे आणि असा कयास आहे की इथे या भागात आत्ता चारशे बंगाली वाग आणि जवरपास तीस हजार ठिपकेंची हरने आहेत।
519,जानकार्लो फिसिकेलाचा गाडीवरील ताबा सुटला आणि शर्यत सुरू झाल्यावर लगेचच संपली, ज्यान कारलो फीसी केलाचा गाडी वरेल ताबा सुटला आनी शेरे चुरु धाले वर लगेच चंपली।
520,चाचणी केलेल्या रसायानामध्ये असलेल्या हायड्रोजनच्या ph मधील h आयनांचे प्रमाण ph स्तराद्वारे दर्शवले जाते, चाचनी केलेल्या रसायनान मधी असलेल्या हाइड्रोजन चा पीएच मधील हैच आयनान चे प्रमाण पीएच स्तरा द्वारे दर्शोले जाती
521,तुमच्या हातावरील ओलावा बाह्य थरांसह प्रतिक्रिया करेल ज्यामुळे तुम्हाला मजेशीर अनुभव येईल आणि एक प्रकारचा शेल तयार करेल, तुम्छा हाता वरील उलावा भाईय थरान सह प्रतिक्रिया करेल जा मुले तुम्हाला मजेशीर अनुभव येल आणि एक प्रकारचा शेल तयार करेल
522,1988 पासून मतपेटी पारदर्शक असणे आवश्यक आहे जेणेकरुनमतदार आणि निरीक्षक हे पाहू शकतात की मतदानाच्या सुरूवातीलाआतमध्ये कोणतेही लिफाफे नाहीत आणि योग्य मोजलेल्या आणिअधिकृत मतदारांव्यतिरिक्त कोणतेही लिफाफे त्यात टाकले जाणारनाहीत, एकोनीश्य अठ्यान्शी पासून मतपेटी पारदर्शक असने आवश्यक आहे जिने करून मतदार आणी निरिक्षक हे पाहु शक्तात की मतदानाच्य सुरुवातीला आत्मधे कोणते ही लिफाफे नाहीत आणी योग्य मोजलेल्या आणी अधिकृत मतदारान व्यतिरिक् कोणते ही लिफाफे त्यात टकली जानार नाहीत
523,या महिन्यामध्ये मशहाद येथे अजून एक विमान धावपट्टी ओलांडून पुढे गेले भिंतीला धडकून सतरा जणांचा जीव गेला, या महिन्या मधिये मशहाद येथे अजुन एक विमान धावपट्टी ओलांडून पुढ़े गेले बिंतीला धड़कुन सत्रा जणांचा जीव गेला।
524,रॉस्बी संख्या जितकी लहान असेल तितकाच तो तारा चुंबकीय परावर्तनाच्या बाबतीत कमी सक्रिय असेल, रोजबी संख्या जितकी लहान असेल तितकाच तो तारा चुम्बकिय परवर्ता नचा बापतीत कमी सक्रिय असेल।
525,आम्हाला निश्चितपणे माहित नाही परंतु कदाचित त्यास काटेरी जीभ असेल त्याच्या आहारात कासव मोठे मासे इतर मोसासोर यांचा समावेश होता आणि कदाचित तो नरभक्षकही असू शकतो, आमाला निश्चित पणी माहित नाही परंतु कदाचित त्यास काटेरी जीब असेल त्याचा आहारात कासो मोठे मासे इतर मोसा सोर याचा समश होता आनी कदाचित ते नरबक्षे ही असुशेकताद
526,भारी कर आकारणी असणाऱ्या देशांकरिता प्रवासी कधीकधी विशेषत मद्य आणि तंबाखूसारख्या उत्पादनांवर मोठ्या प्रमाणात पैशांची बचत करू शकतात, भारी कर आकारणी असनार्य देशान करीता प्रवासी कधी कधी विशेष तह मद्य आणी तम्बाखु सार्ख्या उत्पादनान वे मोठ्या प्रमानात पैशेंची बचत करू शक्तात।
527,"इराणच्या झॅग्रोस पर्वतांमध्ये सुमारे 10,000 वर्षांपूर्वी शेळ्यांना प्रथम पाळीव प्राण्यांच्या स्वरुपात स्वीकारले गेल्याचे दिसते", इरांच ज्यागरू स्परोतान मदे सुमारे दाजार वाश्यन पुरी शेलेना प्रत्थम पालियो प्रानेंच सुरुपा शिकार ले गेलेच दिस्ते।
528,जर हिवाळ्यात उत्तर बाल्टिक ओलांडत असाल तर केबिनचे स्थान तपासा कारण बर्फातून प्रवास करताना जे अत्यंत प्रभावित आहेत त्यांच्यासाठी भयानक गोंधळ करू शकते, जर हिवाल्यात उत्तर बाल्टिक उलांडत असाल तर के बिंच स्थान्त पासा कारण बर्फातुन प्रवास करताना जे अत्यंत प्रभावित आहेट तैंचा साथी भयानक गोंधल करूँ शक्ते।
529,"""त्याचे कार्य इतक्या मान्यताप्राप्त गुणवत्तेचे आणि तपशीलवार आहे की परोपकारी लोकांपैकी ते खूप कमी लोकांपैकी 1 असे ""घराघरातील नाव"" आहे. काही जण केवळ एकट्याने त्याचे कार्य संकलित करण्यात प्रवीण आहेत.", त्याचे कारे इतक्या प्रमाण्यता प्राप्त गुनोवत्तेचे आने तप्षिल्वार आहे की परोपकारी लोकान पैकी ते खूब कमीय लोकान पैकी एक असे घरा घरातिल नाव आहे काई जन किवलेबाले एक ट्याणी त्याचे कारे संकलित करने प्रवी नाहीत।
530,सभ्यता ही एकल संस्कृती आहे जी लोक समाजात एकत्र राहतात आणि सहकार्याने काम करतात अशा लोकांच्या मोठ्या समुदायाने सामायिक केलेली असते, सभ्यता ही एक एकल संस्कृत्या ही जी लोग समस्तात एकतर रातातानी सकरेन काम करतात अश्या लोकांच मोठ्या समदायने सामाईक किलिली अस्ते
531,आज केवळ ड्रॅगन फ्लाइज आणि मेफ्लाइज हे कीटक त्यांचे पंख दुमडू शकत नाहीत, आज केवर ड्राग्गन फ्लाइज आनी मे फ्लाइज हे किता त्यांजे पंख दूरु शकत माहित।
532,आपण केवळ शिपबोर्ड सहल वापरुन किनारपट्टीवर जात असल्यास आपल्याला वेगळ्या व्हिजाची 2009 पर्यंत आवश्यकता नाही, आपन के वर्षिप गोर्डस अलवाप्रुन के नारपति वर जातासल्यास आपल्याला विग्री विजाची 2009 परिंत आवशक्ता नाही।
533,विलगीकरण आणि पुन्हा संयोजन हे प्रत्येक पिढीसह 2 पुल्समध्ये मागे आणि पुढे फेरबदल करते, वीलगीकरण आणि पुण्हासयोजन ये प्रत्येक पीड़ी सह दोन पुल्स मधे माके आणि पुढ़े फेर बल्दल करते।
534,व्हिडिओ रेकॉर्डिंगच्या वापरामुळे काही मिलिसेकंदांपर्यंत टिकून राहणाऱ्या सूक्ष्म अभिव्यक्ती चेहऱ्यावरील हावभावांच्या स्पष्टीकरणात महत्त्वपूर्ण शोध लावले गेले आहेत, वीडियो रिकॉर्डिंग च्या वापरा मुले काही मिली सेकंदान परेंत टिकुन रहानार्या सूक्ष्म अभिव्यक्ती चेहर्या वरील हावभावान च्या स्पश्टी करनात महत्वपूर्ण शोद लावील गिले आहित।
535,परंतु हे सत्य नाही या दस्तऐवजाच्या पाठीमागे काहीतरी लिहिले असले तरी तो एक खजिन्याचा नकाशा नाही, परन्तु हे सत्य नाही या दस्तवजाच्या पाठी मागे काही तरी लिहले असले तरी तो एक खजीनाच्या नकाशा नाही।
536,काल सकाळी गाझियनटेप टर्की येथे पोलीस मुख्यालयामध्ये झालेल्या कार बॉम्बस्फोटात २ पोलीस अधिकारी मारले गेले आणि इतर वीस लोक जखमी झाले, काल सकले गाजियां टोप तरकी ये ते पोलीस मुख्यले मदे जालेले कार वास्पोटा दोन पोलीस अधिकरी मारले गेले आने इतर वीस लोग जख्मी जाले
537,रविवारी उशिरा संयुक्त राष्ट्रसंघाचे अध्यक्ष डोनाल्ड ट्रम्प यांनी प्रेस सुरक्षेच्या मार्फत दिलेल्या विधानात यूएस सैनिक सीरिया सोडत असल्याची घोषणा केली, रविवारी उशीरा सैयोक्त राष्ट्र संघाचे अध्यक्ष डोनाल्ड ट्रंप यान्नी प्रेस सुरक्षेच्या मार्फद दिलेल्या विधानात यू ऐस सैनेक सीरिया सोडत असलेची घूशना केली।
