,reference,transcription
0,पोलिस अधीक्षक चंद्र शेखर सोलंकी यांनी सांगितले की आरोपी चेहरा झाकून घेऊन कोर्टात हजर झाला, पोलिक्स अधिक्षक चंद्रशेकर सोडंकी यानि साइजलेकी आरोपी चेरा जाकोन गेवन कोर्टा थजर जाला।
1,वन्यजीवांचा विचार केल्यास मादागास्कर आतापर्यंत सर्वात मोठे आहे आणि एक स्वतःच खंड आहे, जिवांचा विचार केलेज मादा गासकर आत्ता परिंत सर्वत मूटी आई आनी एक सुत्ता खंडाई।
2,जे कोणी उंच भागात किंवा पर्वतांवरील रस्त्यावरून गाडी चालवणार आहेत त्यांनी हिम बर्फ किंवा गोठणबिंदूखालील तापमानाची शक्यता विचारात घ्यावी, जे कोणी उंच भागात किवा पर्वतान वरील रस्त्या वरून गाड़ी चला उनार आहेद त्यानी हिम बर्फ किवा गोठन बिंदु खालील तापमानाची शक्यता विचाराद घ्यावी।
3,१९७६ पर्यंत माचू पिचूची तीस टक्के पुनर्स्थापना करण्यात आली होती आणि आजही जिर्णोद्धार सुरू आहे, 1970 परेंत माचु पिचु चिंती स्टक्के पुनर स्थात्मा कर्णाताली होती आणि आज जही जिर्णधार सुर्वाही।
4,तुम्ही सामान्यत नेहमीच पर्यटक आणि विक्रेत्यांचे आवाज ऐकता आवाज आणि प्रकाशाची गोष्ट ही अगदी एखाद्या गोष्टीच्या पुस्तकासारखी आहे, तुम्ही सामन्यत निहिमीच परिटक आनी विक्रतेंची आवज एकता आवज आनी प्रकाशाची गोष्ट ही अगदी एकान्य गोष्टींचा पुस्तका सरकी आही।
5,सर्व उपलब्ध स्त्रोत संस्थेच्या सर्व कार्यान्वित विभागांमध्ये परिणामकारक वापरल्यास कलात्मकता आणि कल्पकता दिसून येते, सर्वप्लब्ध स्त्रोच सोस्ते चा सर्वकारे अन्विति विभागान मद्दे परिणाम कारक्वा परल्यास कलात्मक्तानी कलपक्ता दिसुनेते
6,या महिन्यामध्ये मशहाद येथे अजून एक विमान धावपट्टी ओलांडून पुढे गेले भिंतीला धडकून सतरा जणांचा जीव गेला, या मैन्या मद्य मश्यह एथेज अजूनी एक विमान दापटी उलाणु पुड़े गेले बिंतिला डटकों सत्रा जणांचा जिव गेला।
7,सिंट्राचे रोमँटिक आणि मोहक शहर हे उत्तरेकडे व सहज पोहोचता येऊ शकणारे आहे तसेच लॉर्ड बायरनने रेकॉर्ड केलेल्या त्याच्या वैभवाच्या भव्यतेच्या वर्णनानंतर हे परदेशी लोकांमध्ये देखील प्रसिद्ध झाले आहे, सिंट्राचे रोमेंटिक आनिमोहक शर्हे उत्तरे कड़े वस्साज पहुचता ही शक्नारे आहिरसिज लोर्ड वायरन ने रेकॉर्ड केलेले तैंचा वैवाग चा बवित तेचा वर्ष नानंतर हे पुर्देशी लोकामरे देखिं प्रसिद्ध जाले आहे
8,अपिया ही सामोआ ची राजधानी आहे हे शहर उपोलू बेटावर आहे आणि याची लोकसंख्या फक्त 40000 च्या आत आहे," अप्या ही सामोवाची राजधानी आहे, हे शहर उपोलू बेटावर आहे आणि याची लोकसंख्या फक्त 40,000 चा आता है।"
9,वनस्पती ऑक्सिजनची निर्मिती करतात ज्याचा उपयोग मनुष्य श्वास घेताना करतो आणि ते कार्बन-डायऑक्साईड घेतात जो मनुष्य उच्छ्वासाद्वारे बाहेर सोडतो म्हणजेच श्वास सोडणे, वनस्पती ओक्सिजन ची निर्मिती करतात ज्याचा उप्योग मनुष श्वास घेताना करतो आणि ते कार्बन डाय ओक्साइट घेतात जो मनुष उच्छवासा द्वारे बाहर चोडतो मनजेच श्वास चोडने
10,मार्टेलीने काल 9 सदस्यांच्या नवीन प्रोविजनल इलेक्टोरल काउन्सिलमध्ये सीईपी शपथ घेतली, मातली ने काल नव सदसंजानविन प्रोविजिनल इलेक्ट्रोल काउंसिल मद्दे सीपी शप्पत गेतली
11,शेंजेन झोन असला तरी याबाबतीत काही प्रमाणात एखाद्या देशासारखा कार्य करतो, शेंजन जोन असला तरी या बाबतीत काही प्रमाणात एकाद्या देशा सारखा कार्य करतो।
12,"""मुहम्मदला या सांसारिक जीवनापलिकडील गोष्टींमध्ये अतिशय रुचिहोती. तो ज्ञानप्राप्तीसाठी ""नूर"" प्रकाश पर्वतावरील ""हिरा"" नावानेप्रसिद्ध झालेल्या एका गुहेत वारंवार जात असे."," मुहम्मद ला या साउंसारिक जीवना पलीकडील कुष्टिन मधे अतिशे रूची होती तो ग्यान प्राप्ती साथी नूर, प्रकाश, पर्वतावरील, हीरा नावाने प्रसिद्ध जालेले एक गुहित वारंवार जात असे।"
13,रिप/रक्षी प्रवाह हे किनाऱ्यापासून वेगळ्या झालेल्या लाटांपासून परतणारा प्रवाह असतात सहसा प्रवाली किंवा तत्सम ठिकाणी, रिप रक्षी प्रवाह हे किनार्या पासून वेगल्या जालेल्या लाटान पासून परत नारा प्रवाह अस्तात सहजा प्रवाली किम्वा तच्छम ठिकानी
14,जितका तणाव कमी तितकी सकारात्मक जीवन उर्जा अस्तित्वात असते प्रत्येक व्यक्तीकडे संपूर्ण शांती आणि समाधान मिळवण्याची क्षमता असते, जितका दणाव कमी तितकी सकारात्मक जीवन उर्जा अस्तित्वात अस्ते प्रतेक व्यक्ति कड़े संपूर्ण शांती आणि समधान मिलवना चे शम्ता अस्ते
15,प्रत्येकजण समाजात सहभागी होतो आणि वाहतुक यंत्रणांचा वापर करतो जवळपास प्रत्येकजण वाहतूक यंत्रणांबाबत तक्रार करतो, प्रत्येक जर्ण समाजात सहबागी होतो आणी वहतुग यंत्रानांचा वापर करतो। जवलपास प्रत्येक जर्ण वहतुग यंत्रानां बाबत तक्रार करतो।
16,त्याला सुरुवातील ग्रेट यारमाउथ येथील जेम्स पॅगेट रुग्णालयात दाखल केले होते, त्याला सुर्वतिला ग्रेट याये यार माउती थिल जेव्स प्रैगेट तुम्हाले दाखन केले होती।
17,"तथापि रीगा शांतता करार सोव्हिएत-पोलिश नॉन-अ‍ॅग्रेशन करार तसेच अन्य आंतरराष्ट्रीय करार द्विपक्षीय आणि बहुपक्षीय दोन्हीच्या उल्लंघनामुळे पोलंडच्या पूर्व प्रदेशावर आक्रमण केल्यानंतर सोव्हिएतच्या युनियन रेड आर्मीच्या 800,000 सैनिकांनी प्रवेश केला आणि बेलारूस आणि युक्रेनियन फ्रंट तयार केला तेव्हा या योजना जवळपास रातोरात अप्रचलितपणे प्रस्तुत केल्या गेल्या", तथा भी रीगा शांतता करार सोवियत पॉलिश नोन एग्रेशन करार तसेच अन्य आंतर रश्ट्री करार दूपक्षे आने बहुपक्षे दूनी चा उलंगना मुले पोलन चा पूर्व प्रदेशा वर आक्रमन केला नंतर सोवियत चा यूनियन रेड आर्मी चा आठ लक्ष सैनिकान नी प्रवेश केला आने बेडारूस आने यूक्रेनियन फ्रंट तयार केला तेहा या एउजना जवलपास रातुरात अप्रशलित पणे प्रस्तुत केला गेला
18,त्याच धर्तीवर पुरुषांना गुडघे झाकणारे ट्राउझर्स घालणे आवश्यक आहे, त्या दर्ती वर पुरुष्यानना गुडगे जाकनारे ट्राउजर गालने आशे काही?
19,हे संबंधित आहे परंतु सामान्यत अल्पाइन स्टाईल स्की टूरिंग किंवा पर्वतारोहणात यांचा समावेश नसतो नंतर लोकांनी उतार असलेल्या प्रदेशात स्कीइंग केले तसेच यासाठी जास्त स्किफर स्की आणि बूट आवश्यक असतात, हे सम्बंदित आहे परंतु सामान्यत तह अल्पाइन स्टाइल स्की टूरिंग क्यूंवा पर्वता रोहनात यांचा समावेश नस्तो। नंतर लोकानी उतार असलेल्या प्रदेशात स्कीइंग केले तसेस या साथी जास्त स्की फर स्की आनी बूट आवश्यक अस्तात।
20,उदाहरणार्थ प्रत्येक वर्षी उत्तर कॅलोरिनातील बेनेट शाळेचे विद्यार्थी त्यांच्या राज्याच्या राजधानीला भेट देण्याच्या सहलीसंबंधी वेबसाइट तयार करतात प्रत्येक वर्षी वेबसाइट पुन्हा तयार केली जाते पण तिच्या जुन्या आवृत्त्या स्क्रॅपबुक प्रमाणे ऑनलाइन ठेवल्या जातात, उधारनार्था प्रत्यक वर्षी उतर कैलोरेना तील बेनेट शालेचे विद्यार्थी त्यांचे राज्याचे राजधानीला भेट देनाचा स्थहरली संबंदी वेप्साइट तयार करतात। प्रत्येक वर्षी वेबसाइट पुना तयार केली जाते पण तीच्या जुन्या आवरत्या स्क्रैप बुक प्रमाणे ओनलाइन ठेवल्या जातात।
21,त्यांच्या अत्यंत भरभराटीच्या काळात प्रकाशाचे प्रदूषण ही आजच्या काळासारखी समस्या नव्हती ते सहसा शहरांमध्ये किंवा कॅम्पसमध्ये राहत होते त्यामुळे आधुनिक काळात बनवलेल्या ठिकाणांपेक्षा तेथे पोहोचणे सोपे आहे, त्यांचा अत्यंत भरभर टीच्या कालात प्रकाशाचे प्रदूशन ही आजच्या कालासार्खी समस्या नवती। तेर सहसा शहरान मदे किवा कैम्पस मदे रहात होते। त्यामले आधुनिक कालात बनवलेला ठिकालान पेक्षा तेते पहुशने सूपे आहे।
22,त्याचा लांब जबडा 70 पेक्षा अधिक तीक्ष्ण दातांनी भरलेला होता त्याच्या तोंडाच्या वरच्या भागात एक अतिरिक्त संच याचा अर्थ त्याच्या मार्गात जो कोणी येईल त्याला कोणतीही सुटका नाही, त्याचा लाम जबड़ा सत्तर प्रेक्षा अधिक दिक्ष्ण दाता निभर लेला होता। त्याचा तुण्डाच्या वर्च्या भागात एक अतिरिक्त संज्य याचा अर्थ त्याचा मार्गात जो कोणी येल त्याला कोणती ही सुटका नहीं।
23,त्याच्या 78 शिफारशींपैकी प्रथम म्हणजे विरोधी हस्तक्षेपांविरूद्ध इराकच्या सीमा सुरक्षित करण्यासाठी आणि त्याच्या शेजारील राष्ट्रांसोबत राजनैतिक संबंध पुन्हा स्थापित करण्यासाठी या वर्षाच्या अखेरीस एक नवीन परराष्ट्रसंबंधाविषयक कुशलतापूर्वक पुढाकार घ्यावा, त्याच्या सत्यांशी शिपारिशीन पैकी प्रथम मन्जे विरोधी हस्तक शेपान विरुध इराक्च सीमा सुरक्षित करने साथी आणि त्याच्या शेजारिल राष्ट्रां सुबत राजनैतिक संबंध पुना स्थापिक करने साथी या वर्षाच्या अखेरीज एक नवीन पर राष्ट्र संबंधा विशयक कुशलता पूर्वक पुढ़ाकार घ्यावा
24,लहान मुले आणि जेष्ठ यांच्या समावेशासह सहा ओलीस व्यक्तींना फिलिपिनो फोटोग्राफर प्रमाणे लवकर सोडण्यात आले, लाहान मुले आणी जेष्ट यांच्या समावेशा सह सहा उलिस व्यक्तिन्ना फिलिपिनो फोटोग्राफर प्रमाने लवकर सोडनेत आले।
25,पर्यटकांना पूर्वीच्या इमारती मूळ रूपात कशा दिसत असतील याची चांगल्याप्रकारे कल्पना यावी याकरिता बहुतांश इमारती पुन्हा निर्माण करण्यात आल्या आहेत, परे टकाना पुरीचे इमार्थी मूल रूपात कशे दिसा जस्तील याची चांगले प्रकार कल्पने याविया करिता बहुताश इमार्थी पुन्ना निर्वान करने ताले आहित।
26,क्रांतिकारी युद्ध चालू असताना तेरा राज्यांनी एक कमकुवत मध्यवर्ती सरकार बनवले फक्त कॉंग्रेस हाच त्याचा महत्वाचा भाग होता संघराज्यातील कलमानुसार," क्रांतिकर्युद्ध चालु अस्तानात तेरा राज्यानि एकम कुवत मद्देवर्ति सर्कार बनोले, फक्त कांग्रेस हात्याता मक्कमाता तबावोता संगराज्या तिलकल मनसार।"
27,खरेतर हे अस्तित्वात आहे हे एखाद्याला माहिती असले तरी ते शोधणे अजिबात सोपे नाही एकदा गुहेच्या आत गेल्यानंतर ते पूर्णपणे विलगीकरण केल्यासारखे आहे, खरीतर ही आस्तित्वता ही एका देला माहित असली तरीते शोधने अजिवत सोपे नाई। एक दागुए चाहत गेले नतर ते पूर्ण पनी विलेगी करन्न केले सर क्या ही।
28,ओस्ट्रेलियाचा मिशेल गॉर्ले पुरुषांच्या उभ्या सुपर-जी मध्ये अकराव्या क्रमांकावर आला चेकचा प्रतिस्पर्धी ओल्डरिच जेलीनेक पुरुषांच्या बैठ्या सुपर-जीमध्ये सोळाव्या क्रमांकावर आला, अस्ट्रेलिया चा मिशेल गारले पुरुषानचा उभ्य सुपर जी मधिये अकराव्या क्रमाकान वर आला चेक चा प्रतिस्पर्धी ओलिलड्रीच जेलिनेक पुरुषानचा बैठ्या सुपरी जी मधिये सोड़ाव्या क्रमांका वर आला प्रस्तुत्र प्रस्तुत्र प्रस्तुत्र
29,जसे ग्रीकांचे ज्ञान ओसरले तेव्हा पश्चिमेला हे लक्षात आले की ते ग्रीक तत्वज्ञान आणि शास्त्र यांच्या मूळापासून तोडले गेले आहेत, जसे ग्रीकांचे न्यान उसरले तेवा पश्चिमेला हे लक्षात आले कि ते ग्रीक तत्वन्यान आणी शास्त्र यांचा मुळापासुन तोडले गेले आहेथ।
30,"तथापि क्षय असणाऱ्या लोकांच्या समूहामध्ये एक्सडीआर-टीबी ची टक्केवारी अद्याप तरी कमी वाटते दक्षिण आफ्रिकेमध्ये संक्रमित झालेल्या एकूण 330,000 लोकांपैकी एकावेळी 6,000 जणांना", तथा पी ग्षय असनार्या लोकान च्या सम्वा मदे XDRTB ची तक्के वरी अध्याप्तरी कमे वडते। दक्षिन अफ्रीके मदे संक्रमित थलेले एकुन तीन तीन शुन्य शुन्य शुन्य शुन्य लोकान पेकी एकाली साहा जर्ब जनाना।
31,हॉंग कॉंगची सर्वोत्तम दृश्ये मिळवण्यासाठी बेट सोडून कोवलून धबधब्याच्या विरुध्द बाजूला जा, होंकोंक्ची सर्वोत्तम द्रश्य मिरोने साथी बेट सोड़ून कोगलून धबधब्याच्या विरुध बाजूलाजा।
32,विसाव्या शतकातील संशोधनात असे दिसून आले आहे की अनुवांशिक भिन्नतेचे 2 समूह/पुल्स आहेत: छुपे आणि व्यक्त, विसावे शत्कतिल सव्षदनात असे दिसुनाले आहे कि अनुअशिक विन्नतेचे दोन समुआ पूल साहित छुपे अनिव्यक्त।
33,ही जोडपी त्यांच्या बाळासाठी दत्तक घेण्याची योजना बनवण्याचे ठरवू शकतात, ही जोडपी त्यांचा बाला साथी दत्तक घेनेची योजना बनावनेचे ठरवू शक्तात।
34,स्प्रिंगबॉक्ससाठी याने 5 सामन्यांच्या पराभवाची मालिका समाप्त केली, स्प्रिंग बॉक्स अटी पानी पा समन्यांच प्रवाची मालिका समप्ति किली
