,reference,transcription
763,उपस्थित असणारे लोक इतके अधिक होते की प्रत्येक सेंट पीटर चौकात अंत्यविधीसाठी जागा मिळणे शक्य नव्हते, उपस्तित अस्वनारे लोग इतके अधिक होते कि प्रत्येक सेंट वीडर चौकात अंतिविधी साथी जागा मिलने शक्य न होते।
764,या पुलाखालील ऊर्ध्व मोकळी जागा 15 मीटर्स आहे याचे बांधकाम ऑगस्ट 2011 मध्ये पूर्ण करण्यात आले मार्च 2017 पर्यंत तो वाहतुकीस खुला झालेला नव्हता, या पूला खाली अर्द्व मुक्री जाग 15 मीटर साई याचे बांधकाम अगस्ट 2011 मद्य पूर्ण करने ताली मार्श 2017 पर रेंट तो वावतीकी स्कूला जालेला नलता
765,त्यांना खवले आणि नख्या असलेले पाय असतात ते अंडी घालतात आणि ते टी रेक्स प्रमाणे त्यांच्या मागच्या 2 पायावर चालतात, त्यानना खवले आनी नख्या असलेले पाय अस्तात ते अंडी घालतात आनी ते टी रेक्स प्रमाने त्यानचा माखचा दोन पायावर चालतात
766,मानसशास्त्रासह विज्ञानातील सर्व विषयांवर अरिस्टॉटलचे मत स्वीकारले गेले, मानस शास्त्रा सह विज्ञानातील सर्विश्यान्वर अरिस्टूटल चे मत सीकार लेगेले
767,जरी एक प्रायोगिक लस इबोलाचा मृत्युदर कमी करू शकली असली तरी आतापर्यंत कोणतेही औषध आधीच झालेल्या संसर्गाला योग्यरित्या लागू पडलेले नाही, जड़ी एक प्रायोगेक लस इबोलाचा मृत्यदर कमी करूशेकली असली तरी आता परेंत कोंते योशेदादी जालेले संजगरगाला योग्यरीत्या लागू फडलेले नाही।
768,रद्द करण्याची धोरणे वेगवेगळी असू शकतात पण आता मार्चच्या शेवटी कोरोनाविषाणूवर आधारित रद्द करण्याची धोरणे जुलै २०२० जेव्हा ऑलिम्पिक नियोजित आहे त्याच्या पुढे वाढवलेली नाहीत, रद्ध करनेची धोरने वेग वेगली असु शक्तात पण आता मार्च च्या शेवटी कोरोना विशानू वर आधारीत रद्ध करनेची धोरने जुलाई 20-20 जेवा ओलिंपिक न्योजित आहे त्याच्या पुढ़े वाढवलेली नाहीत।
769,वनस्पती ऑक्सिजनची निर्मिती करतात ज्याचा उपयोग मनुष्य श्वास घेताना करतो आणि ते कार्बन-डायऑक्साईड घेतात जो मनुष्य उच्छ्वासाद्वारे बाहेर सोडतो म्हणजेच श्वास सोडणे, वनस्पती ओक्शिजन ची निर्मिती करता त्यांचा उपूयग मनुष्य श्वास गेता ना करतो आनी ते कार्बन डायोक्साइड गेता जो मनुष्य उच्छ श्वासा द्वारे बहेर शोडतो मन्जे श्वास शोडने
770,इंटरनेट सामूहिक आणि परस्परसंबंधित दोन्ही घटक एकत्र करते, इंटरनेट सामुहिक आणि परस्पर संबंधित दोनी घटके कत्र करते हैं।
771,या फॉरमॅटचा आस्पेक्ट रेशिओ सर्वात सोपा पूर्ण-संख्येतील रेशिओ प्राप्त करण्यासाठी बाराने भागणे म्हणून 3:2 असल्याचे समजले जाते, हा फॉर्मेट चा अस्पेक रेशियो सर्वात सोपा मनों संकेतिल रेशियो प्राप्त जाल करने साथी बाराने भागने मनों तीन पॉइंट दोन असलेची समझले जाती है।
772,वाहन त्याच दिवशी अंदाजे दुपारी 12:00 वाजता अपघात स्थळापासूनदूर नेण्यात आले होते, वाहन त्याज दिवशी अंदाजे दुपारी बारा वास्ता अपगात स्तला पासुन दूर नेण्यात आले होते
773,अनेक जर्मनीमध्ये बेक केलेल्या वस्तूंमध्ये बदाम हेझलनट्स आणि इतर ट्री नट्स देखील असतात लोकप्रिय केक्सची मजा विशेषतः एक कप स्ट्रॉंग कॉफीसह चांगल्याप्रकारे घेता येते," अनेक जर्मनी मधे बेग केलिल्या वस्तुन मधे बदाम, हेजल नट्स आणी इतर ट्री नट्स देखिल अस्तात। लोगप्रिय केक्स ची मजा विशेश तह एक कप स्ट्रॉंग कॉफी सह चांगले प्रकारे घेता येते।"
774,बेटांच्या बाहेर क्रेडिट कार्ड कदाचित स्वीकारली जाणार नाहीत तरी ब्रिटिश आणि युनायटेड स्टेटचे चलन घेतले जाईल कोणती पेमेंट पद्धती स्वीकार्ह आहे हे मालकाला आधीच विचारून जाणून घ्या," बेटांच बाहर प्रेडिट कार्ड कदाचित स्वीकारली जानार नहीं, तरे बृतिश आणि युनाइटेड स्टेट ची चलन घेत ले जाई, कुनती पेमेंट पद्धती स्वीकारह आहे, हे मालकाला आधीच विचारून जानूं ख्या।"
775,पिरॅमिड आवाज आणि लाइट शो या लहान मुलांसाठी त्या क्षेत्रातील सर्वात मनोरंजक गोष्टी आहेत, प्यारे मिड आवाज आनी लाइट शो या स्लहान मोलां साथी त्या सेत्रतिल सर्वत मोनोरंजे गोश्टी आहित।
776,लोकांना प्राचीन काळापासून सोने चांदी आणि तांबे या मूलभूत रासायनिक मूलद्रव्यांविषयी माहित आहे कारण हे सर्व निसर्गात मूळ स्वरूपात आढळू शकतात आणि प्राचीन साधनांचा उपयोग करून खाणीतून काढणे अगदी सोपे आहे," लोकान प्राचीन काला पासुन सोने, चांदी आणि ताम्बे या मूल भूत रासायनिक मूल द्रव्यान विशयी माहित आहे, कारण हे सर्वनि सर्गात मूल स्वरुपात आधलू शक्तात आणि प्राचीन साधनांचा उप्योग करून खानी तून काड़ने अगदी सोपे आ प्राचीन काला प्राचीन साधनांचा उप्पात आधलू शक्तात आधलू शक्तात"
777,हा अपघात वर डोंगराळ भागात घडून आला आणि असा विश्वास आहे की हे भयानक अशा आगीमुळे घडून आले असावे, हा अपगात वर डोंग्रा राल भागात घडून आला आनी असा विश्वास आहे की हे भयानक अशा आगी मुले घडून आले असावे
778,एक हजार वर्षांहून अधिक काळ चर्चचा केंद्रीय अधिकार रोममध्ये होता तसेच सत्ता आणि पैशांच्या या केंद्रीकरणामुळे अनेकांना हा प्रश्न पडला की हा सिद्धांत अस्तित्वात होता का, एक हजार वर्षान हुन अधिकार चर्च चा केंद्रिय अधिकार रोम मधी हुता तसेच सत्ता आनी पैश्यान चा या केंद्री करना मोई अनेकान्ना हा प्रश्न पढ़ला कि हा सिध्धान्त अस्तित्वात होता का।
779,मनोरंजनाच्या वृत्तवाहिनी वेबसाइट tmz ला कळते की छायाचित्रकाराने सेपूलवेद बूलेव्हर्डच्या दुसऱ्या बाजूला त्याची गाडी थांबवली आणि रस्ता ओलांडून पुढे जाण्याआधी पोलीस थांब्याचे फोटो घेण्याचा प्रयत्न केला कॅलिफोर्निया हायवेच्या गस्तीवर असणाऱ्या पोलिसाला त्याला ओलांडून मागे परत जाण्याची आज्ञा देण्यासाठी दोनदा रहदारीला थांबवणे भाग पडले, मनोरंजनाच्या व्रत्तभाईनी वेबसाइट टीम्जेडला कर्टते कि छाया चित्रकाराने सेपुलवेद बुल्हेवर्ड च्या दुसरा बाजुला त्याची गाड़ी थांबावली आणि रस्ता ओलांडून पुढ़े जानेचा आधी पोलिस थांब्याचे फोटो घ्या ओलांडून पुढ़े जानेचा आधी पोलिस थांब्याचे फोटो घ्या
780,2002 मध्ये नायरागोंगो ज्वालामुखीतील शीलारसामुळे गोमा नष्ट झाला ज्यामुळे विशेषत शहराच्या मध्यभागी असलेले शहरातील बहुतेक रस्ते उध्वस्त झाले, दोन हजार दोन मधे नायरा गुंग जौला मुख्य तील शीला रसा मुड़े गुमा नष्ट जाला ज्या मुड़े विशेष्ट शहरा चा मद्धे भागी असलेले शहरा तील भौतिक रस्ते उद्ध्वस्त जाले।
781,"""मुहम्मदला या सांसारिक जीवनापलिकडील गोष्टींमध्ये अतिशय रुचिहोती. तो ज्ञानप्राप्तीसाठी ""नूर"" प्रकाश पर्वतावरील ""हिरा"" नावानेप्रसिद्ध झालेल्या एका गुहेत वारंवार जात असे.", मुह मदला ये सांसरिक्स जिवना पली कड़े लुगोष्टिन मदे अतिश्य रुची ही उती तो ध्यान प्राप्ती सटी नूर प्रकाश परोता वरील हिरा नावाने प्रसिद्ध जालेल एक गुहे त्वारंवार जातसे
782,सर्व संज्ञा तुमच्यासाठी sie या शब्दाबरोबरच अगदी वाक्याच्या मध्यभागी असले तरीही नेहमी मोठ्या लिपीने सुरू होतात, सर्वसद्न्य दुम्जा साथी साई या शब्द बरोबर और सगदी वाक्याचा मद्दे बागे असले तरीही नेमे मोठ्या लिपीन सुरू होतात।
783,अग्नीशामक दलाने अखेरीस रात्री 11:35 पर्यंत आग काबू केली, अग्निशामुक दराने खिरिच रात्री आक्रा पस्तिस परिंदाग काबुगेली
784,आरमारांचे पारंपरिक काम असते त्यांच्या देशातील लोक आणि वस्तुमालाची वाहतूक करण्याची क्षमता टिकवणे त्याचवेळी आपल्या शत्रूचे लोक आणि वस्तुमालाची वाहतूक करण्याच्या क्षमतेत हस्तक्षेप करणे, आर मारांचे पारंपारिक काम अस्तें त्यांचा देशाति लोक आणि वस्तु मालाची वाहतुक करनेची क्षम्ता टिकाऊने त्याच विळी अपले शत्रुचे लोक आणि वस्तु मालाची वाहतुक करनेची क्षम्तेद हस्तक्षेप करने
785,सैनिक येण्यापूर्वी हैतीला 1800 पासून या रोगाशी संबंधित समस्या उद्भवल्या नव्हत्या, सैनिक येने पुर्वी हैतीला 1800 पासुन या रोगाशी संबंदे चमस्या उद्भावल्या नहत्या
786,usa जिम्नॅस्टिक्स आणि usoc यांचे लक्ष्य समान आहे जिम्नॅस्टिक्स आणि इतर खेळांना खेळाडूंकरिता सुरक्षित सकारात्मक आणि सशक्त वातावरणात त्यांच्या स्वप्नांना पूर्ण करणे शक्य तितके सुरक्षित बनविणे," USA GYMNASTICS और USOC यांचे लक्ष सामान्या हैं। GYMNASTICS और इतर खेलानना खेला डून करीत सुरक्षित, सकारात्मक और सशक्त वातावरणात त्यांचे स्वप्नानना पूर्ण करने शक्य तित्के सुरक्षित बनवीने। प्रस्तुत्र प्रस्तुत्र"
787,सुंदरबन ल जगतील वारसा स्थळ म्हणून यूनेस्को ने जाहीर केले आहे जंगलाचा भारतातील भाग हा सुंदरबन राष्ट्रीय उद्यान म्हणून ओळखला जातो, सुन्दर्बन ला जगतिल वर्षास तर्मनुन इनिस्कुन जैर केले आहे जंगलाचा वार्तिय वागा सुन्दर्बन रश्टिव देमन उलखले जातो।
788,याचा परिणाम म्हणून माशांच्या 2 प्रजाती विलुप्त झाल्या आहेत आणि हम्पबॅक चब सह इतर 2 विलुप्त प्राय झालेल्या आहेत, याचा परिणाम अनुन माशांचा दोन प्रजाती विलुक्त जाले आहेट आनी हंप बेक चब इस इतर दोन विलुक्त प्राये जाले आहेट
789,काही मार्गावर मोठ्या कंपन्यांची  त्यांची स्वत:ची विमाने असू शकतात परंतु इतर मार्गांसाठी  आणि छोट्या कंपन्यांना तिथे काही समस्या आहेत, काई मार्गान और मोट्या कमण्यान कम्पन्यान ची तें ची सोता ची मन्या शक्तात। परंतु इतर मार्गान साथी आने छोटे कम्पन्यान ने ती थे काई समस्या हैत।
790,मोरोक्कन सुलतानाने दारू-इ-बड्या या नावाने शहर पुन्हा वसवले आणि तिथे आपले व्यापारी तळ तयार केलेल्या स्पॅनिश व्यापाऱ्यांनी त्याला कासाब्लँका असे नाव दिले, मोरोक्कन सुल्तानाने दारूई बड़्या या नावाने शहर पुन्हा वसहले अणि तिथे आपले व्यापारी तड़ तयार केलेल्या स्पैनिश व्यापार्यानी त्याला कासा ब्लांका असे नाव दिले।
791,इथे अजूनही काही पुरूष व स्त्रिया जिवंत आहेत जे त्यांच्या अस्तित्वासाठी झगडत आहेत तसेच यहूदी आणि गैर-यहूदी सारख्या अनेकांच्या प्रियजनांची हत्या केली गेली किंवा जीवे मारले गेले होते, इथे अजु नहीं कई पुरुष वस्तरिया जिवन ताहित ते तैंचास्ते तौसाची जगड ताहित तसे जिहुदी आने गईर यहुदी सार्क्या आने कांचा प्रिय जनांची हत्य केली गिली क्यों जिवे मारले गिली होते
792,कापड खूप अधिक गरम होणार नाही याची काळजी घ्या नाहीतर ते आकसेल किंवा अतिशय वाईट म्हणजे जळेल, कापड खूब अधित गरम होनार नाही यची कालजी घ्या नाही तरते आकसेल क्यों अतीशे वाइट मन्जे जरेल
793,चीनच्या आर्थिक आउटपुटवर आधारित ते ठरवले जाईल असे म्हणून त्यांनी कटसाठी कोणतीही संख्या ठरवली नाही, चीन चार्थिक आटपूट वरादरे ते ठरोले जायलासे मुनन तेनी कट साथी कौंती संक्य ठरोले नाही।
794,वाघाची डरकाळी एखाद्या सिंहाच्या पूर्ण आवाजातील डरकाळीसारखी नसते परंतु फेंदारून ओरडून उच्चारलेल्या शब्दांच्या वाक्यासारखी अधिक असते, वागाची डरकाई एकाले सियाचा गुर्ण आवाजातिल डरकाई सार्की नस्ते पुरंतु फेदारुन औरडुन उच्चार लेला शब्दांचा वाक्य सार्की अधिक अस्ते।
795,जर हिवाळ्यात उत्तर बाल्टिक ओलांडत असाल तर केबिनचे स्थान तपासा कारण बर्फातून प्रवास करताना जे अत्यंत प्रभावित आहेत त्यांच्यासाठी भयानक गोंधळ करू शकते, जर हिवाल्यात उत्तर बाल्टिक उलांडात असाल तर केबिंचे स्थान तपासा कारण बर्फातून प्रवास करतानना जे अत्यंत प्रभावित आहिर तेंचे साथी भयाना गोंधल करू शक्ती।
796,याद्वारे ऑरोरा बोरियालिस पाहण्याची एक चांगली संधी आहे कारण आकाश सतत अधिक किंवा कमी गडद राहील, या द्वारे अरोरा बोलियालिस पानेची एक चांगली संद्या है कारणाकार सतत अधिक क्या कमिक गेड़त राहिल।
797,या फॉरमॅटचा आस्पेक्ट रेशिओ सर्वात सोपा पूर्ण-संख्येतील रेशिओ प्राप्त करण्यासाठी बाराने भागणे म्हणून 3:2 असल्याचे समजले जाते, या फॉर्मिट चा आस्पिक्ट रेश्यो सर्वत सोप्य पूर्ण संकेती रेश्यो प्राप्त करने साथी वाराने भागने मुन तीराज दोन अस्तिलयाचे समझले जाते हैं।
798,माउ चळवळीने आयोजित केलेल्या स्वातंत्र्यासाठीच्या संघर्षावेळी शहरातील शांततापूर्ण सभेची परिणती सर्वोच्च प्रमुख तापुआ तामासेसे लीलोफी iii यांच्या हत्येत झाली, माऊ चलवली ने आईजित केलेला स्वतंत्र्या साथीचा संगर्शा विली शेरातील शांतता पुर्ण सबेची परिनिती सुरोच्य प्रमुक तप्वा तमासेसे लिलोफी यंचा हाते जाली।
