,reference,transcription
248,काही भागांमध्ये एक मिनिटासाठी पाणी उकळणे पुरेसे असेल तर इतर ठिकाणी काही मिनिटेही गरजेची असू शकतात, काही भागान मधिये एक मिनिटा साथी पानी उकरने पुरेसे असेल तर इतर ठिकानी काही मिनिटे ही गरजेची अख्यू शक्तात।
249,लखा सिंग यांनी छप्पन बोग भजन देखील सादर केले गायक राजू खंडेलवाल त्यांच्या बरोबर होता, लखा सिंग यन्नी छपन भोग भजन देखिल सादर केली कायक राजु खंडेल वाल त्यंचा बरूबर होता।
250,"""मागील आठवड्यात meti ने जाहीर केले की अॅपलने 34 अतिरिक्त ओव्हरहिटिंग घटनांची माहिती दिली होती ज्यास कंपनीने ""नॉन-सिरीयस"" असे म्हटले आहे.", मागे लाठोडयत मेटी ने जाहिर केले की अपल ने 34 अतिरिक्त ओर हिटिंग गटनांची माहिती दिली होती जैस कंपनी ने लॉम सीरियस असे वडल्या ही
251,शास्त्रज्ञ हे प्रतिपादन करण्यात यशस्वी ठरले की गडद पदार्थ इतर गडद पदार्थांना तसेच परिणाम करतात जसे की सामान्य पदार्थ करतात, शास्रद्ने हे प्रतिपादन कर्न्यात एशस्वी ठले की गड़त पदर्थ इतर गड़त पदर्था ना तसेच परिणाम करता जसे की सामनी पदर्थ करता।
252,स्प्रिंगबॉक्ससाठी याने 5 सामन्यांच्या पराभवाची मालिका समाप्त केली, स्प्रिंग बॉक्स साथी याने पात सामान्यांचा पराभवाची मालिका समाप्त केली।
253,हे सांगण्याची आवश्यकता नाही की जर तुम्हाला रोमन भाषा येत असेल तर तुमच्यासाठी पोर्तुगीज शिकणे सोपे होईल, हे सांगनेची आवशक्ता नाही कि जर तुम्हाला रोमन भाषेत असेल तर तुम्चे साथी पुर्तगीच शिकने सोप्पे होईल।
254,एक हजार वर्षांहून अधिक काळ चर्चचा केंद्रीय अधिकार रोममध्ये होता तसेच सत्ता आणि पैशांच्या या केंद्रीकरणामुळे अनेकांना हा प्रश्न पडला की हा सिद्धांत अस्तित्वात होता का," एक हजार वर्षान हुन अधिक काल चर्चचा केंद्रिय अधिकार रोम मधे होतो, तसेच सत्ता आणि पैशांच्या या केंद्री करना मुले अनेकान नहा प्रश्न पढ़ला की हा सिद्धान्त अस्तित्वात होता का?"
255,तीव्र हवामान ही संज्ञा कोणत्याही अशा धोकादायक अशा हवामान घटनांना सहसा दिली जाते ज्यामध्ये नुकसान करण्याची गंभीर सामाजिक व्यत्यय आणण्याची किंवा मानवी जीवनाला इजा करण्याची क्षमता असते, तीवर हवामान ही संग्या कोणत्याही अशा धोकादायग आशा हवामान घटनाना सहसा दिली जाती ज्या मधे नुकसान करने ची गंभीर सामाजिक व्यत्य आपने ची किम्वा मानवी जीवनाला इजा करने ची शम्ता असते।
256,कापड खूप अधिक गरम होणार नाही याची काळजी घ्या नाहीतर ते आकसेल किंवा अतिशय वाईट म्हणजे जळेल, कापड खूब अधिक गरम होनार नाही याची कालजी घ्या नाही तर ते आकसेल क्योंवा अतिशे वाइट मनजे जडेल
257,तुम्हाला आपल्याला देशातील रस्त्यावर वाहन चालवण्याची सवय नसल्यास तुमच्याबद्दलची माहिती स्पष्ट करा उंच ग्रेड अरुंद गल्ल्या आणि तीव्र नागमोडी मार्ग, तुम्हाला अपलेला देशातिल रस्ते वर वहान चालो नयाची सवय नसले तुम्चा बुद्धल ची मायती स्पष्ट करा। उन्च ग्रेले रुंद गल्या नी तिवर नागवडी मार्ग।
258,"""पेरी म्हणाले की ""आजच्या रात्रीच्या कॉकसचे निकाल पाहण्यासाठी टेक्सासला जाईन आणि या शर्यतीत पुढे जाण्यासाठी मला काही मार्ग आहे का हे ठरवेन"" पण नंतर ते म्हणाले की ते शर्यतीत राहतील आणि २१ जानेवारीला दक्षिण कॅरोलिना प्राथमिकमध्ये स्पर्धेत उतरतील.", पेरी मनाले की आजच्या रातर दीचा कॉक्स चे निकाल पाहने साथी टेक्सास ला जाईन आनी या शर्तित पुढ़े जाने साथी मला काही मार्ग आहे का हे ठरवेन पन्नंतर ते मनाले की ते शर्यतित राहतील आनी 21 जाने वारीला दक्षिन कैरोलीना प्रात्मिक मधे स्पर्धित उतरतील
259,"""त्यावर ""विची"" फ्रेंच राज्य करत होते. या फ्रेंच लोकांनी १९४० मध्ये जर्मनीबरोबर शांतता प्रस्थापित केली होती आणि हल्लेखोरांबरोबर युद्ध करण्याऐवजी काम केले होते.", त्या वर वीची फ्रेंच राज्य करत होते या फ्रेंच लोकानी 1940 मधे जर्मनी बरोबर शांतता प्रस्थापित केली होती आणि हल्ले खुरान बरोबर युद्ध करने अईवजी काम केले होते।
260,चीनच्या आर्थिक आउटपुटवर आधारित ते ठरवले जाईल असे म्हणून त्यांनी कटसाठी कोणतीही संख्या ठरवली नाही," चीन चार्थिक आटपोट वराधरी ते ठरोले जाईल, असे मनों ते निकट साथी कोंती संके ठरोली नाही।"
261,विशेषतः असा दावा केला जातो की सूक्ष्म हावभावांचे योग्यरीतीने विश्लेषण करून माणूस खोटे बोलत आहे का हे एखादी व्यक्ती जाणू शकते, विशेष्टह असा दावा किला जातो कि सुक्ष्म हावभावांचे योग्य रीतीने विशलेशन करून मानुष खोटे बूलत आहेका हे एकादी व्यक्ति जानु शक्ते।
262,"""""""तो [वेल्स] मुळात आमच्याशी सुरुवातीपासूनच खोटे बोलला. प्रथम हे कायदेशीर कारणांसाठी होते असा अभिनय करून. दुसरे म्हणजे त्याची कला हटविण्यापासून तो आमचे ऐकत असल्याचे भासवून.""""", ते विल्स मुनात अम्चे शिसुर्वती पासोन अस खुट बोला प्रतम ये काईदिशिर करने साथी होते आता असा अभिनाय करोन दुसरे मंजे तेची कला आहटुने पासोन ते अम्चे एकत असलेचे बासोन
263,ओस्ट्रेलियाचा मिशेल गॉर्ले पुरुषांच्या उभ्या सुपर-जी मध्ये अकराव्या क्रमांकावर आला चेकचा प्रतिस्पर्धी ओल्डरिच जेलीनेक पुरुषांच्या बैठ्या सुपर-जीमध्ये सोळाव्या क्रमांकावर आला, अस्ट्रिलियाचा मिशेल गॉर्ट पुरुषाचा उभ्या सुपरजी मते दाकरावय करमां काउराला। चेकसा पतिसपर्दी उल्डरीच जेलीने पुरुषाचा बैठा सुपरजी मते सोडावय करमां काउराला।
264,पॅरिसवासीयांची अहंकारी उद्धट आणि गर्विष्ठ असण्याची ख्याती आहे, पैरिस वासीयंची अहंकारी उद्धट आनी गर्विष्ट असनेची ख्याती आहे।
265,परंतु कर्णधाराची विकेट गमावल्यानंतर भारताने डाव समाप्त करण्यासाठी केवळ 7 विकेट गमावत 36 धावा केल्या, परंतु कर्णदर्ची विकेट गमा लेन अंतर वार्ताने डाव समाप्त करने साथी केवल साथ विकेट गमा 36 डावा केले
266,कॅल्शियम आणि पोटाशियम या सारखी मूलद्रव्ये धातू मानली जातात अर्थातच चांदी आणि सोने यासारखे सुद्धा धातू आहेत, क्याल्चियम आनी पोटेशेमिया सार्की मुल्द्रवे धातू मानली जातात। अर्थातात चांदिया आनी सोनिया सार्के सुद्धा धातू आहित।
267,त्यांनी या अफवा वायफळ राजकीय बडबड आणि मुर्खपणा'' असल्याचे म्हटले, त्यान नया आप वावाई फळदाच किये बडबडानी मुर्क पनासलेचे मटले
268,"""ते पुढे म्हणाले की ""त्यांची विकास अवस्था जबाबदारी आणि क्षमतांहून अधिक उत्तरदायित्वे घेण्यास मात्र त्यांना विचारले जाऊ नये.""""", ते पुड़े मनाले की त्यांची विकास अवस्ता जबाबदारी आनिक शम्तान हुन अधिक उत्तरदाइत्वे गिन्यास मात्र त्यांना विचारले जाओ नहीं।
269,कॅलिफोर्नियाचे राज्यपाल अर्नोल्ड श्वार्झनेगर यांनी अल्पवयीन मुलांना हिंसक व्हिडिओ गेम्सच्या विक्री किंवा भाड्याने देण्यासंबंधीच्या कायदेशीर विधेयकावर स्वाक्षरी केली आहे, कैलीफोर्नियाचे राज्यपाल अर्नेल्ड श्वार्जनेगर यानी अलपवीन मुदिना हिंसक विडियो गेमचा विक्री किवा भाड़ाने जेन सबंदीचा काईदेशीर विदेयकावर स्वाप्शिरी कीली आहे।
270,ऑलिव्हर सॅक्स यांनी त्यांच्या पेपर द प्रेसिडेंट स्पीच' मध्ये असे म्हटले आहे की जे लोकं मेंदूच्या क्षितीमुळे भाषण समजण्यास असमर्थ आहेत परंतु तरीही ते प्रामाणिकपणाचे अचूक मूल्यांकन करू शकतात," ओलिवर साक्स यन्नी त्यांचा पेपर द प्रेसिडेंट स्पीज मधे असे मठले आहे की जे लोक मेंदू चा खिती मुले भाशन समझने अस असमर्थ आहेद, परन्तु तरीही ते प्राथमिक प्रामानिक पणायची अचूक मुल्यांकन करूँ शक्तात. परन्तु तरीही त्यांचा पेपर द प्रेसिडेंट स्पीज मधे असे मधे असे मधे असे मुल्यांकन करूँ शक्तात."
271,"""सहसा हे केवळ चुकीचे स्टिरिओटाइप असते तरीही पॅरिसमध्ये राहण्याचा उत्तम मार्ग म्हणजे तुम्ही सर्वोत्कृष्ट वर्तणूक करणे आणि ""बेन एलेव्ह"" चांगले संगोपन झालेले अशा एखाद्या व्यक्तीसारखे वागण्याचा अभिनय करणे. हे एखादी गोष्ट मिळविणे सोपे करेल.", सहसा हे केवड चुकी चे स्टीरोटाइप असते तरीही पैरिस मधे रहने चा उत्तम मार्ब मन्जे तुम्ही सर्वोत्क्रष्ट वर्तनू करने आनी बेन एलेव चांगले संगूपन जालेले अशा एकाद्या व्यक्ति सार्खे वागने चा अभिनय करने हे एकादी गोष्ट
272,लोक आता कॉम्प्युटरच्या स्क्रिन्सवर संदेश लिहितात कधीही एखाद्या शार्पनरचा वापर करावा लागत नाहीत, लोग आता कॉंपीटर चे स्किरीन वर संदेश लीतात कदी एक अजय शार्पुन चे वापर करावा नागत नाई
273,शत्रुत्वाच्या उद्रेकानंतर ब्रिटनने लगेचच जर्मनीच्या नौदलाची नाकेबंदी सुरू केली, शत्रुत्वाच्या उद्रेकानंत ब्रिटन ने लगेचस जर्मनीच्या नौदलाची नाकेबंदी सुरुकेली।
274,हे दक्षिण आफ्रिकेच्या मुख्य आकर्षणांपैकी 1 आहे आणि हे दक्षिण आफ्रिकेच्या राष्ट्रीय उद्यानांचे sanp पर्क्स प्रमुख चिन्ह मानले जाते, ये दक्षिन आफरिके चा मुख्याकर सेनापाईकी एक आहे आनी ये दक्षिन आफरिके चा राष्टिय उद्ध्यानाची सैम पाक्स पमुख चिन्ना वानले जाते
275,इतर दक्षिण आफ्रिकी राष्ट्रीय उद्यानांप्रमाणे या उद्यानासाठीही रोज संवर्धन आणि प्रवेश शुल्क आकारले जाते, पर दक्षिन आफरीकी राष्ट्रिय उद्यान प्रामन या उद्यान साथी ही रोज सव्वर्धनानी प्रवेश शुल्खा करले जाते हैं।
276,शेंजेन झोन असला तरी याबाबतीत काही प्रमाणात एखाद्या देशासारखा कार्य करतो, शिंजिन जोन असला तरिया बाप्तित काही प्रमाणात एकाद्या देशा सार्खा कार्य करतो।
277,मोल्दोवाची राजधानी चिशिनव्ह आहे स्थानिक भाषा रोमानियन असली तरी रशियन भाषेचा जास्त वापर होतो," मुल्दोवाची राजदानी चीनश्न्यू आहे, स्थानिक बाश्या रुमनियन आसली तरी रसियन बाश्यचा जस्तवापर होतो।"
278,व्हर्च्युअल टीम्सकरिता पारंपारिक टीम्सप्रमाणेच उत्कृष्टतेचे मानक ठेवले जातात परंतु त्यात सूक्ष्म फरक असतो, वर्च्यूअल टीम्स करिता पारंपानेक टीम्स रुमानेच उत्कृष्टेचे मानक ठेवले जाता परंतो त्याच सुक्ष्मा परकस्तो।
279,त्याचप्रकारे एक शेंगेन व्हिसा असल्यावर आपल्याला प्रत्येक शेंगेन सदस्य देशांसाठी स्वतंत्र व्हिसा साठी आवेदन करावे लागत नाही त्यामुळे वेळ पैसा आणि कागदी काम वाचते, त्यास प्रकर एक शेगन विजा असल्या अवर आपल्याला प्रतेक शेगन सदस्य देशा साथी स्वतंत्र विजा साथी अविधन करावे लागत नाही त्यामले वेल पैसा आनी अगदी काम वास्ते
280,ही दृश्ये पिरॅमिड्सवर प्रदर्शित करुन आणि विविध पिरॅमिड्स प्रकाशमान केले जातात, ही दर्शे पिरेमिट्स वर प्रदर्शित करूं आणि विवित पिरेमिट्स प्रकाशमान के ले जातात।
281,ही सेवा बऱ्याचदा जहाज सेवे कडून वापरली जाते आरामदायी विमानांसह त्याच बरोबर ज्यांना दूरस्थ डेटा आणि आवाजाची आवश्यकता असते, इस सेवा बर्याचता जहार सेवे कुणुम अपले रत्याराम दाईवी मनांचा त्याज बुरबत्याना दुरस्त डेटा आने आवाजाची आउशक्ता अस्ते।
282,खेळामध्ये बंदी असल्यामुळे त्याला त्याच्या दुखण्यावर मात करणारी औषधे घेता आली नाहीत, खेला मधे बंदी असले मुले त्याला त्याचा दुखने वर मात करनारी आउशदे घिता आली नाहीत।
283,चंद्राचा पृष्ठभाग खडक आणि धूळ यांनी बनलेला आहे चंद्राच्या बाह्य थराला क्रस्ट म्हणतात, चंद्राचा पुष्ट भाग खड़क आने धोल यन्नी बनलेला है चंद्राचा बायो धराला क्रस्त मनतात।
284,हे बंदर 1889 मध्ये घडलेल्या कुख्यात नाविक घटना घडली हे स्थान आहे जेव्हा जर्मनीच्या अमेरिकेच्या आणि ब्रिटनच्या 7 जहाजांनी आपले बंदर सोडण्यास नकार दिला होता, ये बंदर 1891 मधी घडलेल्या कुख्यात नाविक घटना घडली हे स्थान आहे जिवा जर्मनी च्या अमेरिके च्या आणि बिरिटन च्या साथ जहा जानी आपले बंदर सोडने सनकार दिला होता
285,डेल पोत्रोला दुसऱ्या सेटमध्ये सुरुवातीचा फायदा होता पण ६-६ वर पोहोचल्यावर एका टाय ब्रेकची आवश्यकता होती, डेल पोत्रेला दुसरे सेट मदी सुर्वातीचा फाइदा होता पण 6-6 वर पोत्रेला रेक टाई ब्रेक ची आउशक्ता होती।
286,करी ही एक मांस किंवा भाज्या यांसह औषधी वनस्पती आणि मसाल्यांवर आधारित डिश आहे, करी ये एक मास्क या भाजा यान सह आउशेदी वनस्पती यानी मासाले नो राधर डीशा है।
287,पॅरिसवासीयांची अहंकारी उद्धट आणि गर्विष्ठ असण्याची ख्याती आहे," पैरिस वासियांची उहंकारी, उद्धट आणि गर्विष्ट अस्न्याची ख्यातिया है।"
